,uri,track_name,artist,explicit,danceability,energy,key,loudness,speechiness,acousticness,instrumentalness,liveness,valence,tempo,popularity,lyrics
88,spotify:track:1CF5kzz5XDBAL24wtVyyTJ,Take Your Man,Mahogany Lox,True,0.934,0.658,0,-8.052,0.108,0.411,0.000738,0.0809,0.344,110.015,53,"[Intro]I can take your man if I want toI can take your man if I want to[Chorus]I can take your mans if I want to (Want to)But lucky for you, I don't want to (Want to)I can take your mans if I want to (Want to)But lucky for you, I don't want to (Want to)[Verse 1]Why you coming at me with an attitude? (Huh?)Slapping on my ego, now I'm mad at you (Shoo)Now I gotta do what I gotta do (Hmm)Kinda sad, don't even like the dude[Pre-Chorus]Not Mickey D's, but he's lovin' it (Lovin' it)Tall glass of water, gotta take a sip (Take a sip)Call him Arby's 'cause he has the meat (The meat)Pipe down, girl, better take a seat (A seat)[Chorus]I can take your mans if I want to (Want to)But lucky for you, I don't want to (Want to)I can take your mans if I want to (Want to)But lucky for you, I don't want to (I don't want to)"
90,spotify:track:1eyzqe2QqGZUmfcPZtrIyt,Midnight City,M83,False,0.526,0.712,11,-6.525,0.0356,0.0161,0.0,0.179,0.32,105.009,73,[Instrumental Intro][Verse 1]Waiting in the carWaiting for a ride in the darkAt night the city growsLook at the horizon glow[Instrumental Bridge][Verse 2]Waiting in the carWaiting for a ride in the darkDrinking in the lightsFollowing the neon signsWaiting for a word (Word)Looking at the milky skyline (Skyline)The city is my church (The city is my church)It wraps me in its blinding twilight (Twilight)[Instrumental Bridge][Outro]Waiting in the carWaiting for the ride in the darkWaiting in the car (Waiting in the car)Waiting for the ride in the dark (Ride in the dark)Waiting in the car (Car)Waiting for the ride in the darkWaiting in the car (Waiting in the car)Waiting for the ride in the darkWaiting in the car (Waiting in the car)Waiting for the ride in the dark
94,spotify:track:2VDadIDCFgDqvVCvaDPtn9,Becky,Championxiii,True,0.934,0.439,4,-9.564,0.338,0.00506,0.0,0.092,0.289,140.022,44,"[Intro]Hey manY'all be asking and askingAnd asking for this shit manHahaha, I guess I'll drink for this shit manLook, look[Chorus]I knew this bitch named Becky (Becky, Becky, Becky)She like to talk real sexy (Ugh, nasty bitch)I had to tell her she gon' stop, yeah, yeah'Cause everybody know that she a thot (Fucking nasty bitch)[Post-Chorus]But this shit don't stop, never ever, nahMan, I'm swervin' in the coupe and I skrrt off the lot (God, God)This shit is so hot, I am the man, yeah (I'm the man)Ham? Sam-I-Am (Hell yeah) Goddamn[Verse]Yeah, flame kicks, game six, yeahBad bitch in a new whipIce cold, frostbitTik Tok but don't talk about itBlew a stack before I thought about itStupid b, I had to run around itChamp on, I had to boast about it (Champ)Saw your girl, didn't think twice (Nah)Suit up, then I take flight (Skrrt)Gotta get to the bag right (Blaow)Never sleep up all night (Yeah)She talk shit but can't hit tight (Nah)Make moves, she make timeI see her while I'm flyShe sees me and it's on sight 'cause"
95,spotify:track:6ocbgoVGwYJhOv1GgI9NsF,7 rings,Ariana Grande,True,0.778,0.317,1,-10.732,0.334,0.592,0.0,0.0881,0.327,140.048,85,"[Verse 1]Yeah, breakfast at Tiffany's and bottles of bubblesGirls with tattoos who like getting in troubleLashes and diamonds, ATM machinesBuy myself all of my favorite things (Yeah)Been through some bad shit, I should be a sad bitchWho woulda thought it'd turn me to a savage?Rather be tied up with calls and not stringsWrite my own checks like I write what I sing, yeah (Yeah)[Pre-Chorus]My wrist, stop watchin', my neck is flossyMake big deposits, my gloss is poppin'You like my hair? Gee, thanks, just bought itI see it, I like it, I want it, I got it (Yeah)[Chorus]I want it, I got it, I want it, I got itI want it, I got it, I want it, I got itYou like my hair? Gee, thanks, just bought itI see it, I like it, I want it, I got it (Yep)[Verse 2]Wearing a ring, but ain't gon' be no ""Mrs.""Bought matching diamonds for six of my bitchesI'd rather spoil all my friends with my richesThink retail therapy my new addictionWhoever said money can't solve your problemsMust not have had enough money to solve 'emThey say, ""Which one?"" I say, ""Nah, I want all of 'em""Happiness is the same price as red-bottoms"
98,spotify:track:2tnVG71enUj33Ic2nFN6kZ,Ride It,Regard,False,0.88,0.751,7,-4.258,0.0874,0.177,6.43e-05,0.106,0.884,117.948,81,"[Chorus]Ride it, we're all aloneRide  it, just lose controlRide  it, ride it, come touch my soulRide it, ride, let me feel youRide it, turn the lights down lowRide  it, from head to toeRide  it, ride it, touch my soulRide it, ride, let me feel you[Verse 1]It's  been a month and twenty daysAnd we're going 'round and 'round, playing silly gamesNow you're saying, slow it down, not right nowThen ya wink at me and walk awayLet  it be, let it be, let it be knownHold on, don't goTouching and teasing me, telling me noBut this time I need to feel you[Chorus]Ride it, we're all aloneRide it, just lose controlRide it, ride it, come touch my soulRide it, ride, let me feel youRide it, turn the lights down lowRide it, from head to toeRide it, ride it, touch my soulRide it, ride it, let me feel you"
101,spotify:track:1sOr5OXjbukTzBDgmvd6Fa,Indigo,88rising,False,0.819,0.664,7,-5.612,0.0828,0.0958,1.75e-06,0.263,0.71,144.988,51,"[Verse 1]You know I'm your type, right? (Right)Mark you calendar, tonight's gonna be your life's high light (Light)Boy, we gon' roll up, we gon' roll out, lookThis is the land of fast, bet you ain't used to that, nawFirst one will not be last, she can stay in your past, honeyI don't stop for no one but I pause for you, you, you, you[Pre-Chorus 1]So let's go out on town and get real highIt'd be psycho to psychoanalyzeLeave all of your inhibitions behindTonight let's test all the borderlines like[Chorus]How far out does the indigo go?Boy, let's find out, take the longer way homeHave my body all super-imposedRight on top of yours, ohAs far as the indigo goesI'm hatin' that you're still in your clothesBaby, touch me slow, how high does she goLike oh, oh, oh, oh[Verse 2]Know you like a little attitude (Attitude)A little spunk, a little gumptionWell, baby, have a lot of gratitude'Cause I can be sweet or poised or little too feisty to function, yeahSo shut up and just hop in, we gon' ride in styleIf thrill was a sport, I'd be the poster childI listen to none, but I'm all ears for youYou and you, yeah"
102,spotify:track:3nKZknHg5Y5fPB3gow8ACG,Crystal Dolphin,Engelwood,False,0.558,0.776,9,-6.868,0.179,0.33,0.000445,0.41,0.247,128.064,59,[Intro]Hora dorufinDoru fanHora dorufin doru fan doru fon[Hook]Do do do do do doDo da do dooDo da doo doooooDodo do daDo da do doDo do do dooMmmDodo do doDo do doo doDo da do dooOhhDodo do dooDodo do dooDoo dooooo[Instrumental Breakdown][Bridge]Hora dorufinDoru fanHora dorufin doru fan doru fon
103,spotify:track:3d8y0t70g7hw2FOWl9Z4Fm,Ophelia,The Lumineers,False,0.664,0.573,5,-6.519,0.0277,0.613,0.000363,0.0857,0.566,76.023,79,"[Verse 1]Ah, ah, when I was youngerI, I should've known betterAnd I can't feel no remorseAnd you don't feel nothing back[Verse 2]I, I got a new girlfriend hereFeels like he's on topAnd I don't feel no remorseAnd you can't see past my blindness[Chorus]Oh, OpheliaYou've been on my mind, girl, since the floodOh, OpheliaHeaven help the fool who falls in love[Verse 3]I, I got a little paycheckYou got big plans and you gotta move (Whoo!)And I don't feel nothing at allAnd you can't feel nothing small[Pre-Chorus]""Honey, I love you""That's all she wrote"
105,spotify:track:2VOomzT6VavJOGBeySqaMc,Disturbia,Rihanna,False,0.707,0.813,11,-4.515,0.0571,0.0863,0.0,0.168,0.722,124.921,80,"[Intro]Bum bum be-dum, bum bum be-dum bum(What's wrong with me?)Bum bum be-dum, bum bum be-dum bum(Why do I feel like this?)Bum bum be-dum, bum bum be-dum bum(I'm goin' crazy now)Bum bum be-dum, bum bum be-dum bum[Verse 1]No more gas, in the red (Can't even get it started)Nothin' heard, nothin' said (Can't even speak about it)All my life on my head (Don't wanna think about it)Feels like I'm goin' insane, yeah[Pre-Chorus]It's a thief in the night to come and grab you (Ah)It can creep up inside you and consume you (Ah)A disease of the mind, it can control you (Ah)It's too close for comfort, ah[Chorus]Put on your brake lightsYou're in the city of wonderAin't gon' play niceWatch out, you might just go underBetter think twiceYour train of thought will be alteredSo if you must falter, be wise"
107,spotify:track:2ravLKGYnJWa7szKSBRTRJ,Corduroy Dreams,Rex Orange County,True,0.609,0.305,4,-14.037,0.053,0.653,0.0,0.103,0.222,113.818,69,"[Verse 1]How could I ignore you?Trust me I adore youWe’re swimming through our dreamsKiss me in the showerFor a couple hoursThough we’re only sixteenAnd sit down beside meDon’t call me daddyCause that’s just fucking weird ‎Promise that you'll stay hereYou and I can lay hereUntil the end of time[Chorus]But girl, well don't you worry about meIt ain’t new to me, feeling this lonely (Darling)Girl, don't worry about meBut if you’re ever unhappyThen maybe, baby, I must let you goLet you go[Verse 2]Baby, now it’s best here, to lay me down and rest hereLet’s dream of CorduroyWork for what you love to do and I will watch right over youWith your heart, I’ll never toyAnd you’re the other half of meDrink and sleep and laugh with meSave me from myselfSee I’m a fucking basket-caseUntil I'm able to see your faceYou saved me from myself"
108,spotify:track:2IrPJS5I21gpLydn0HgyiJ,Birthday Suit,Cosmo Sheldrake,False,0.803,0.505,8,-8.012,0.109,0.833,0.000107,0.115,0.74,124.873,58,"[Verse]Weighed down by morningIn my birthday suitLift up the eveningJust for a whileBackwards, upside down and inside outSo hold on or we’ll all fall downOh, heave the oceans doWon’t you?[Outro]I’ll keep my ears onI’ll keep my eyes openI’ll keep my legs in sightAnd wait till we all fall down"
109,spotify:track:1U0hiOuodfSsxdcTYXGEdT,All You Wanna Do,SIX,False,0.738,0.532,11,-7.967,0.187,0.302,0.0,0.0855,0.596,143.991,63,"[ENSEMBLE]All you wanna doAll you wanna do, baby[KATHERINE HOWARD](spoken)I think we can all agree I'm the ten amongst these threes[ENSEMBLE]All you wanna doAll you wanna do, baby[KATHERINE HOWARD](spoken)And ever since I was a child, I'd make the boys go wild[ENSEMBLE]All you wanna doAll you wanna do, baby[KATHERINE HOWARD, spoken](spoken)Take my first music teacher, Henry MannoxI was young, it's trueBut even then, I knew(sung)The only thing you wanna do is... mwah"
110,spotify:track:0Aqi7ArnBrGblW5T6p2jmD,Falling,Trevor Daniel,False,0.785,0.431,10,-8.756,0.0364,0.123,0.0,0.0887,0.236,127.085,79,"[Intro]OhOoh, ooh[Chorus]My last made me feel like I would never try againBut when I saw you, I felt something I never feltCome closer, I'll give you all my loveIf you treat me right, baby, I'll give you everythingMy last made me feel like I would never try againBut when I saw you, I felt something I never feltCome closer, I'll give you all my loveIf you treat me right, baby, I'll give you everything[Verse]Talk to me, I need to hear you need me like I need yaFall for me, I wanna know you feel how I feel for you, loveBefore you, baby, I was numb, drown out pain by pourin' upSpeedin' fast on the run, never wanna get caught upNow you're the one that I'm callin'Swore I thought I'd never fall again, don't think I'm just talkin'I think I might go all in, no exceptions, girl, I need ya[Bridge]Feeling like I'm out of my mind, 'cause I can't get enoughOnly one that I give my time, 'cause I got eyes for yaMight make an exception for ya, 'cause I been feelin' yaThink I might be out of my mind, I think that you're the one"
111,spotify:track:1VJwtWR6z7SpZRwipI12be,Candy,Doja Cat,True,0.689,0.516,8,-5.857,0.0444,0.513,0.0,0.163,0.209,124.876,73,"[Verse 1]I can name a couple ways, baby, this shit might goYou just might forget that this was what you're gettin' high forMen that like to do the things to remain that guy whoNeed someone who's sweet and not gon' shoot to make that high note[Pre-Chorus]And it's such a typical thingRunnin' over billion men whoOnly deal with difficult thingsYou gon' need a billion hands, ooh[Chorus]She's just like candy, she's so sweetBut you know that it ain't real cherry, know that it ain't real cherryShe's just like candy (Candy), she's so sweet (She's so sweet)But you know that it ain't real, know that it ain't real[Verse 2]I can be your sugar when you're fiendin' for that sweet spotPut me in your mouth, baby, and eat it 'til your teeth rotI can be your cherry, apple, pecan, or your key limeBaby I got everything and so much more than she's got[Pre-Chorus]And it's such a typical thingRunnin' over billion men whoOnly deal with difficult thingsYou gon' need a billion hands, ooh"
112,spotify:track:4jTiyLlOJVJj3mCr7yfPQD,This Could Be Us,Rae Sremmurd,True,0.732,0.69,0,-4.992,0.134,0.291,0.0,0.116,0.758,143.072,79,"[Intro: Slim Jxmmi](Hey)I heard it beforeSremmLife!(Hey)(Eardrummers)SremmLife(Mike WiLL Made-It)(Hey, hey, hey)[Verse 1: Slim Jxmmi]I've done it before, I've seen it beforeTears splashin' the floor when I open the door for herShe actin' like a whore and I'ma let herLearned from Project Pat-ta, pimpin', got a Master'sGirl, improvise, look me in my eyes and lie to meLie to me, act like I'll believe anythingSex on the beach and in the backseatThis could be us (But fuck it)[Chorus: Swae Lee & Jace]So back to what I was saying(Money make the world go 'round)This could be us, but you're playing(Money make your girl go down)This could be us, but you're playing(Money make the world go 'round)I'm high, hope I don't sound crazy(Money make your girl go down)Fuck what them niggas was saying(Money make the world go 'round)This could be us, but you're playing(Money make your girl go down)This could be us, but you're playing(Money make the world go 'round)But shit, that's all I was saying(Money make your girl go down and that's just how it go)"
113,spotify:track:5R8dQOPq8haW94K7mgERlO,Poker Face,Lady Gaga,False,0.851,0.806,4,-4.62,0.0787,0.118,1.64e-06,0.121,0.787,118.999,78,"[Intro]Mum mum mum mahMum mum mum mahMum mum mum mahMum mum mum mahMum mum mum mah[Verse 1]I wanna hold 'em like they do in Texas, please (Woo)Fold 'em, let 'em hit me, raise it, baby, stay with me (I love it)LoveGame intuition, play the cards with spades to startAnd after he's been hooked, I'll play the one that's on his heart[Pre-Chorus]Oh, woah-oh, oh, ohOh-oh-oh-oh-oh-ohI'll get him hot, show him what I've gotOh, woah-oh, oh, ohOh-oh-oh-oh-oh-ohI'll get him hot, show him what I've got[Chorus]Can't read my, can't read myNo, he can't read my poker face(She's got me like nobody)Can't read my, can't read myNo, he can't read my poker face(She's got me like nobody)"
115,spotify:track:62AuGbAkt8Ox2IrFFb8GKV,Sweet Caroline,Neil Diamond,False,0.529,0.127,11,-16.066,0.0274,0.611,0.000109,0.237,0.578,63.05,79,"[Verse 1]Where it beganI can't begin to know whenBut then I know it's growing strongWas in the springAnd spring became the summerWho'd have believed you'd come along[Pre-Chorus]Hands, touchin' handsReachin' out, touchin' me, touchin' you[Chorus]Sweet CarolineGood times never seemed so goodI've been inclinedTo believe they never would[Verse 2]But now I look at the nightAnd it don't seem so lonelyWe fill it up with only twoAnd when I hurtHurtin' runs off my shouldersHow can I hurt when holdin' you"
117,spotify:track:0yIywEquxORnu1dR0WYsdN,Love Me,Justin Bieber,False,0.729,0.868,3,-3.319,0.0609,0.00939,0.0,0.283,0.632,124.957,70,"[Verse 1]My friends say I'm a fool to think that you're the one for meI guess I'm just a sucker for love'Cause honestly the truth is that you know I'm never leaving'Cause you're my angel sent from above[Pre-Chorus]Baby you can do no wrong, my money is yoursGive you little more because I love ya, love yaWith me, girl, is where you belong, just stay right hereI promise my dear I'll put nothing above ya, above ya[Chorus]Love me, love me, say that you love meFool me, fool me, oh how you do meKiss me, kiss me, say that you miss meTell me what I want to hear, tell me you love meLove me, love me, say that you love meFool me, fool me, oh how you do meKiss me, kiss me, say that you miss meTell me what I want to hear, tell me you love me[Verse 2]People try to tell me but I still refuse to listen'Cause they don't get to spend time with youA minute with you is worth more thanA thousand days without your love, oh your love, oh"
119,spotify:track:4WYwP4V2SGCUXJGEha0ODM,Tungs,The Frights,False,0.565,0.618,1,-11.316,0.104,0.0697,6.37e-05,0.509,0.5,106.337,53,"[Intro]One, two, three, four[Verse 1]For if we ain't got the timeI tell ya, baby, I don't think we're doing fineWe just haven't got a clueI keep my love, I want my blood inside of you[Chorus]Do you think I'm cute? Well it's too late to checkAnd I don't care, you got your tongue against my neckDo you like my style? Have you seen my shoes?'Cause they've been ripped to shit from walking the world for you[Verse 2]Everybody knows I'm rightI can't control it, I got my eyes on you all nightWe just haven't got a clueI keep my love, I want my blood inside of you[Chorus]Do you think I'm cute? Well it's too late to checkAnd I don't care, you got your tongue against my neckDo you like my style? Have you seen my shoes?'Cause they've been ripped to shit from walking the world for you"
120,spotify:track:3rPtS4nfpy7PsARctAWpzd,Best Friend,Rex Orange County,True,0.576,0.714,6,-5.247,0.0595,0.395,0.0,0.115,0.321,144.981,77,"[Intro]I should've stayed at home'Cause right now I see all these people that love meBut I still feel aloneCan't help but check my phoneI could've made you mineBut no, it wasn't meant to be and see I wasn't made for youAnd you weren't made for meThough it seemed so easy[Chorus]And that's because I wanna be your favorite boyI wanna be the one that makes your dayThe one you think about as you lie awakeI can't wait to be your number oneI'll be your biggest fan and you'll be mineBut I still wanna break your heart and make you cry[Verse]But won't you wait?You know it's too lateI'm on my own shit nowLet me tell you how it feels to be fucking greatI feel greatWhoa, oh, oh, oh, ohYou need to be yourselfLove someone for loving you instead of someone really coolThat makes your heart meltWho knows what you truly feltYou're still my favorite girlYou better trust me when I tell you there ain't no one elseMore beautiful in this damn worldIn this damn world"
121,spotify:track:2PkUVjGspZ5goc98NuGv3v,Video Games,The Young Professionals,False,0.563,0.891,4,-4.511,0.0397,0.0359,0.0,0.0915,0.332,141.965,48,"[Verse 1]Swinging in the backyard, pull up in your fast carWhistling my nameOpen up a beer, and you say ""Get over hereAnd play a video game""I'm in his favorite sundress, watching me get undressedTake that body downtownI say you're the bestest, lean in for a big kissPut his favorite perfume onGo play your video games[Pre-Chorus]It's you, it's you, it's all for youEverything I doI tell you all the time[Chorus]""Heaven is a place on Earth with youTell me all the things you wanna doI heard that you like the bad girls, honey!And is that true?It's better than I ever even knewThey say that the world was built for twoOnly worth living if somebody is loving youAnd, baby, now you do"""
122,spotify:track:1vvBUZseJ7fwYPX1NedOLd,Cha Cha,Freddie Dredd,True,0.792,0.698,1,-6.364,0.172,0.489,0.0788,0.127,0.751,129.971,68,"[Refrain]Noite de luar, a brisa feito o marEu no teu olhar, uma estrela no céuSinto seu desejo ao querer o meu beijoE na hula uma lua de mel, de melDanço a hula huki e o cha-cha-chaSou estrela no céuVem tocar meu corpo sensualQuero ouvir você chamarDanço a hula huki e o cha-cha-chaSou estrela no céuVem tocar meu corpo sensualQuero ouvir você chamar[Chorus]Damn, sonThese bitches want some""Hey, Freddie, can I, um?""No, bitch, you fuckin' dumb (Noite)Damn, sonThese bitches want some""Hey, Freddie, can I, um?""No, bitch, you fuckin’ dumb[Verse]Hello⁠-hello, bitch, what you want?Hittin' up my phone up on some bullshit, huh?Think I give a damn about stealing your 'gram?Bitch, I’m gonna rob you, bitch, I'm on a mission (Noite)Don't wanna suck? Then I don't give a fuckRun your shit, slut, then get my nutBetter not be in the streetsRun up on me, hear a ""Bap, bap,"" then a screech (Noite)I don't mean to hurt youBut I need more moneyKinda funny how the FreddieRun upon you, you a dummy (Noite)Uh oh, I think I gotta goBig bitch, what you wanna know?Made a hit though, kick the back do'Big blast made a flash hole, hole (Noit⁠—)"
123,spotify:track:5JboK5zbbhXIN7iN9NHS8t,Change Ya Life,Haiti Babii,True,0.696,0.399,4,-8.673,0.0369,0.0224,0.0,0.0747,0.364,98.004,57,"[Intro]Suh, ahOoh, oh[Verse 1]Money, power, and respect (Respect)Trick, I'm poppin', and I did it with a check (With a check)Quit complaining, you a rookie, I'm a vetDeMarcus Cousins, bitch, I always got a TECRemember Lil Haiti slept with the chop next to the windowIf they fonkin' with my niggas, then they fonkin' with me tooI got no time to spend it with bitches fucking with the crewIn the grass, they try to snake me, I'm fucking with voodooFrom the streets where young niggas just tryna get paidReminiscing the dead homies, sippin' on cognacMama seen me up on TV and she know this won't stopKnow that Rollie on your wrist got you green, tick tockThick bitch, juicy lips, with some Gucci flip flopsLike if you and I could go out one nightI'll show you a good timePromise you I'll change your mind, just let me freak youKeep this between me and you (Let me freak your mind)[Chorus]Don't go telling all your friends that we in love for real (Girl, you love me, yes, you do)Don't go telling all your friends that we in love for realBaby, get this dick that change your life (Tell me how you feel)"
126,spotify:track:0SiBdjIbyZq5sDbc9vGAmu,Baby Powder,Bandingo YGNE,True,0.804,0.439,1,-9.605,0.365,0.357,0.0,0.162,0.329,150.039,37,"[Intro: Ida Emerson, Joseph E. Howard & Bandingo]Hello, ma' baby, hello, ma' honeyHey, Whoa, YuhHello, ma' ragtime galHitemup, Hitemup, HitemupLil Bih, Lil BihSend me a kiss by wireHey, HeyBaby, my hearts on fireYou finna' die, baby![Verse 1]Nigga run up then I swear he gon get itFuck the police I ain't taking no ticketWho gave you scary ass niggas some breadLookin at yall like a chicken and biscuitDon’t play with me, Cause I swear I get wickedBeast of the West, Get shit jumpin like cricketsSo many hoes don’t you ask can I diggitShe ask how long do I last girl no limitUnless the head too goodThen I might bust in a minute(hm hm)30 on me put a hole in yo fittedHow you a boss but don’t handle yo businessNiggas moving weird they got crablegsReally smart girl but she give bad head"
127,spotify:track:6piAUJJQFD8oHDUr0b7l7q,VALENTINO,24kGoldn,True,0.746,0.717,9,-4.841,0.179,0.199,0.0,0.132,0.523,150.964,72,"[Chorus]I don't want a valentine, I just want ValentinoI just want the neck, I poke her face like a casinoDeep throat, know I get it in like a free throwShawty want some mo', she just can't seem to keep her knees closedI don't want a valentine, I just want ValentinoI just want the neck, I poke her face like a casinoDeep throat, know I get it in like a free throwShawty want some mo', she just can't seem to keep her knees closed[Verse]I fuck her long, ain't no Minute Maid, my diamonds lemonadeFlexin' hard, call me Popeye, wallet filled with spinach, ayyCut you off on the interstate, I'm first to finish, ayyI'm a young, rich nigga, bitch, it's always been that wayTo the grave, might just be tomorrow, might just be todaySo I always live it up, we poppin' bottles, poppin' K'sGucci shades from my bougie bitch, I ain't even had to payHad to put on for the team and had to put on for the BayI'm still fly when I wear Robin's wings, I can't stay in one placeRussian Creams in my rocket ship, we go to outer spaceMask off, mask on, fuck it, I can't catch a caseBlast off, blast off, see the stars up in the WraithYou can't get into the crib because the mansion got a gateYou can't come into my section, I'm gon' put you into placeIf your club goin' up, you bet I'm sliding like it's chessAnd I think I fell in love, she shook that ass up in my face"
128,spotify:track:1GEBsLDvJGw7kviySRI6GX,You Belong With Me,Taylor Swift,False,0.687,0.745,6,-4.432,0.0379,0.178,1.59e-05,0.111,0.435,129.966,76,"[Verse 1]You're on the phone with your girlfriend, she's upsetShe's going off about something that you said'Cause she doesn't get your humor like I doI'm in the room, it's a typical Tuesday nightI'm listening to the kind of music she doesn't likeAnd she'll never know your story like I do[Pre-Chorus]But she wears short skirts, I wear T-shirtsShe's Cheer Captain and I'm on the bleachersDreaming 'bout the day when you wake up and findThat what you're looking for has been here the whole time[Chorus]If you could see that I'm the one who understands youBeen here all along, so why can't you see?You belong with me, you belong with me[Verse 2]Walking the streets with you and your worn-out jeansI can't help thinking this is how it ought to beLaughing on a park bench, thinking to myselfHey, isn't this easy?And you've got a smile that could light up this whole townI haven't seen it in a while since she brought you downYou say you're fine, I know you better than thatHey, whatcha doing with a girl like that?"
