,uri,track_name,artist,explicit,danceability,energy,key,loudness,speechiness,acousticness,instrumentalness,liveness,valence,tempo,popularity,lyrics
1,spotify:track:1i36kkhmhBxf4lYJscg5zK,Fantasy,Bazzi,True,0.699,0.668,5.0,-4.272,0.0336,0.154,3.2e-06,0.362,0.314,144.105,73,"[Chorus]You should knowYou can go where you wanna goI can take you thereWildest dreams, put some faith in meTake my hand to your fantasy[Verse 1]Going through these bottlesFucking with these modelsAll the way in CaliFoot up on the throttleI'm focused on the visionTryna pay tuitionFor the ones I'm missingFamily is a missionOh, yeahPut you on to things you thought were impossibleOn and on, me and you, we unstoppable[Chorus]You should knowYou can go where you wanna goI can take you thereWildest dreams, put some faith in meTake my hand to your fantasy"
4,spotify:track:696DnlkuDOXcMAnKlTgXXK,ROXANNE,Arizona Zervas,True,0.621,0.601,6.0,-5.616,0.148,0.0522,0.0,0.46,0.457,116.735,78,"[Intro]All for the 'GramBitches love the 'GramOh, wait, shitBrr, brr (Ayy, yeah, yeah, yeah, ayy)Brr, brr, brr, ayySkrrt skrrt94 don't need no brakes, yeah[Chorus]Roxanne, RoxanneAll she wanna do is party all nightGoddamn, RoxanneNever gonna love me, but it's alrightShe think I'm an asshole, she think I'm a playerShe keep running back, though, only 'cause I pay upRoxanne, RoxanneAll she wanna do is party all night[Verse 1]Met her at a party in the hills, yeahShe just wanna do it for the thrill, yeahShorty drive a poodle with no top (Top, top)But if I throw this money, she gon' drop, ayyShe don't wait in lines if it's too longShe don't drive the whip unless the roof offOnly wanna call when the cash outOnly take the pic when her ass out"
5,spotify:track:0nbXyq5TXYPCO7pr3N8S4I,The Box,Roddy Ricch,True,0.896,0.586,10.0,-6.687,0.0559,0.104,0.0,0.79,0.642,116.971,84,"[Chorus]Pullin' out the coupe at the lotTold 'em fuck 12, fuck SWATBustin' all the bells out the boxI just hit a lick with the boxHad to put the stick in the box, mmhPour up the whole damn seal, I'ma get lazyI got the mojo deals, we been trappin' like the '80sShe sucked a nigga soul, gotta Cash AppTold 'em wipe a nigga nose, say slatt, slattI won't never sell my soul, and I can back thatAnd I really wanna know where you at, at[Verse 1]I was out back where the stash atCruise the city in a bulletproof Cadillac (Skrrt)'Cause I know these niggas after where the bag at (Yeah)Gotta move smarter, gotta move harderNigga try to get me for my waterI'll lay his ass down, on my son, on my daughterI had the Draco with me, Dwayne CarterLotta niggas out here playin', ain't ballin'I done put my whole arm in the rim, Vince Carter (Yeah)And I know probably get a key for the quarterShawty barely seen in double C's, I bought 'emGot a bitch that's looking like Aaliyah, she a modelI got the pink slip, all my whips is key-lessCompton, I'm about to get the key to the cityPatek like the sea, forgive me"
6,spotify:track:0w5Bdu51Ka25Pf3hojsKHh,Hard Times,Paramore,False,0.695,0.818,5.0,-5.379,0.0334,0.00647,4.87e-06,0.0219,0.916,119.965,75,"[Intro]One, two[Verse 1]All that I wantIs to wake up fineTell me that I'm alrightThat I ain't gonna dieAll that I wantIs a hole in the groundYou can tell me when it's alrightFor me to come out[Chorus]Hard timesGonna make you wonder why you even tryHard timesGonna take you down and laugh when you cryThese livesAnd I still don't know how I even surviveHard times, hard timesAnd I gotta get to rock bottom (Uh)[Verse 2]Walking aroundWith my little rain cloudHangin' over my headAnd it ain't coming downWhere do I go?Give me some sort of signYou hit me with lightningMaybe I'll come alive"
7,spotify:track:1iSqfoUFnQwV0QW1EfUit8,Suicidal,YNW Melly,True,0.735,0.369,9.0,-9.682,0.0688,0.334,0.0,0.126,0.235,140.004,76,"[Intro]SuicidalYour love is suicidalLately, I've been feeling suicidalYour love is suicidal[Pre-Chorus]I thought that we were meant to beYou took my heart and made it bleedI gave you all my ecstasyI know you'll be the death of me (Keep it Z3N)Left lipstick on my HennessyFelt like you took my soul from meYou gave me all your ecstasyI thought that we were meant to be[Chorus]Your love is suicidalFor me, your love is suicidalTo me, your love is suicidalTo me, your love is suicidal[Refrain]I'm sippin' Hennessy-'y-'y, oohI'm sippin' Hennessy-'y-'y, ooh"
9,spotify:track:0fySG6A6qLE8IvDpayb5bM,VIBEZ,DaBaby,True,0.768,0.652,1.0,-2.708,0.307,0.113,0.0,0.107,0.777,154.187,69,"[Intro]Let's go (Yeah, yeah, Neeko, you made that motherfuckin' beat? Ah, nah)You know it's Baby, nigga, hahahaHah(Oh Lord, Jetson made another one), ha[Chorus]She wanna fuck with me, but I don't got the time (Mmh, mmh)I just hopped off a private plane and went and hopped on 85 (Yeah)Go call my chauffeur, bitch, 'cause I don't like to driveWe in Suburbans back to back and we gon' fill 'em up with vibes (Let's go)[Verse 1]Fill 'em with vibes (Yeah), get in and ride (Yeah, yeah)And no, a nigga not blind (Uh-uh)But I keep the stick and I'm firin' (Bitch)I ain't met a nigga in lifeThat's fuckin' with me, say he did, then he lyin' (Mmh, mmh)Got so many vibes stuffed in the carWe can fuck them hoes six at a time (No cap)I make them hoes say, ""That nigga so fine"" (Ooh)""Girl, he got the dick you can feel in your spine"" (Yeah)Yeah, that what they say about BabyYou know that them bitches don't play about BabyBaby should go run for presidentLook what God did, took his time with me (Yeah, yeah)Got a red and white ho like a peppermint (Ooh)Book the hotel, take the vibes inShe gon' fuck me and fuck on my brethren (Uh)My brother 'nem, havin' three hoes in the king sizeI ain't finished yet (Mmh), get another bitch (Mmh)Got her ridin' dick and screamin', ""Yeehaw"" (Mmh, mmh, mmh, mmh)Make me proud, girl, you a cowgirl (Huh?)Did a handstand, I'm like, ""Wow, girl"" (Okay, okay)Got me fuckin' her upside-down (Ooh, mmh), baow, baowYeah, we goin' dumb, say she wanna cum (Mmh)I'm lookin' like, ""When?"" She lookin' like, ""Now""Some more came in, say they want it tooI tagged in my brother, bitch, I'm out (Bye), I know"
11,spotify:track:1mCsF9Tw4AkIZOjvZbZZdT,Break My Stride,Matthew Wilder,False,0.917,0.588,10.0,-11.047,0.0607,0.195,0.0,0.0914,0.828,110.077,74,"[Verse 1]Last night, I had the strangest dreamI sailed away to ChinaIn a little rowboat to find yaAnd you said you had to get your laundry cleanDidn't want no one to hold you, what does that mean?And you said[Chorus]Ain't nothin' gonna break my strideNobody gonna slow me downOh no, I got to keep on movingAin't nothin' gonna break-a my strideI'm runnin' and I won't touch groundOh no, I got to keep on moving[Verse 2]You're on a roll and now you pray it lastsThe road behind was rockyBut now you're feeling cockyYou look at me and you see your pastIs that the reason why you're runnin' so fast?And she said[Chorus]Ain't nothin' gonna break-a my strideNobody gonna slow me downOh no, I got to keep on movingAin't nothin' gonna break my strideI'm runnin' and I won't touch groundOh no, I got to keep on moving"
13,spotify:track:0Aqi7ArnBrGblW5T6p2jmD,Falling,Trevor Daniel,False,0.785,0.431,10.0,-8.756,0.0364,0.123,0.0,0.0887,0.236,127.085,79,"[Intro]OhOoh, ooh[Chorus]My last made me feel like I would never try againBut when I saw you, I felt something I never feltCome closer, I'll give you all my loveIf you treat me right, baby, I'll give you everythingMy last made me feel like I would never try againBut when I saw you, I felt something I never feltCome closer, I'll give you all my loveIf you treat me right, baby, I'll give you everything[Verse]Talk to me, I need to hear you need me like I need yaFall for me, I wanna know you feel how I feel for you, loveBefore you, baby, I was numb, drown out pain by pourin' upSpeedin' fast on the run, never wanna get caught upNow you're the one that I'm callin'Swore I thought I'd never fall again, don't think I'm just talkin'I think I might go all in, no exceptions, girl, I need ya[Bridge]Feeling like I'm out of my mind, 'cause I can't get enoughOnly one that I give my time, 'cause I got eyes for yaMight make an exception for ya, 'cause I been feelin' yaThink I might be out of my mind, I think that you're the one"
17,spotify:track:6jRq8gaZhMUyy5RclRPcAf,hot girl bummer,blackbear,True,0.782,0.559,6.0,-7.106,0.0767,0.125,0.0,0.385,0.685,129.992,79,"[Intro]Fuck you, and you, and youI hate your friends and they hate me tooI'm through, I'm through, I'm throughThis that hot girl bummer anthemTurn it up and throw a tantrum[Verse 1]This that hot girl bummer anthemTurn it up and throw a tantrumThis that throw up in your Birkin bagHook up with someone randomThis that social awkward suicideThat buy your lips and buy your likesI swear she had a manBut shit hit different when it's Thursday night[Pre-Chorus]That college dropout musicEvery day leg day, she be too thickAnd my friends are all annoyingBut we go dumb, yeah, we go stupidThis that 10K on the tableJust so we can be secludedAnd the vodka came dilutedOne more line, I'm superhuman"
19,spotify:track:3Dv1eDb0MEgF93GpLXlucZ,Say So,Doja Cat,True,0.787,0.673,11.0,-4.583,0.159,0.264,3.35e-06,0.0904,0.779,110.962,79,"[Chorus]Day to night to morning, keep with me in the momentI'd let you had I known it, why don't you say so?Didn't even notice, no punches left to roll withYou got to keep me focused; you want it? Say soDay to night to morning, keep with me in the momentI'd let you had I known it, why don't you say so?Didn't even notice, no punches left to roll withYou got to keep me focused; you want it? Say so[Verse 1]It's been a long time since you fell in loveYou ain't coming out your shell, you ain't really been yourselfTell me, what must I do? (Do tell, my love)'Cause luckily, I'm good at readingI wouldn't bug him, but he won't stop cheesin'And we can dance all day around itIf you frontin', I'll be bouncingIf you want it, scream it, shout it, babeBefore I leave you dry[Chorus]Day to night to morning, keep with me in the momentI'd let you had I known it, why don't you say so?Didn't even notice, no punches left to roll withYou got to keep me focused; you want it? Say soDay to night to morning, keep with me in the momentI'd let you had I known it, why don't you say so?Didn't even notice, no punches left to roll withYou got to keep me focused; you want it? Say so (Yeah)"
20,spotify:track:6Ozh9Ok6h4Oi1wUSLtBseN,BOP,DaBaby,True,0.769,0.787,11.0,-3.909,0.367,0.189,0.0,0.129,0.836,126.77,76,"[Intro]You know everybody been waiting on that Baby, manI mean, it's like ever since Baby on Baby dropped, man, like, you know (Ever since Baby on Baby dropped)Ain't nobody drop shit (Oh Lord, Jetson made another one)Let's go, hah[Chorus]I needed some shit with some bop in it (Let's go)I flew past the whip with that blunt in my mouthWatch the swervin', that whip had a cop in it (Woo)My bitch got good pussy, fly her 'cross the countryI finish the show and I hop in it (Mm, mm, mm)I got me a milli', I did it legit-lyI'm still with the shits, I'm a hot nigga (Hot)[Verse 1]Oh, you asking for pictures with niggas? (Huh?)What's your name? Get the fuck out the spot, nigga (Get the fuck)Tryna figure which deal I'ma take (Uh-huh)I woke up, couple mill' on my plate (Let's eat)I'm investing in real and estate (Uh-huh)I just went gave my mama a hundred (A hundred)Probably won't hear me open my mouth'Less you hearin' me talkin' 'bout finding some money (Let's go)As soon as I found it, I flipped that (Flip)I'm a little bit different, they get it (They dig)Know I'm stiff on a bitch and she dig itTryna find out why Baby ain't all in her mentions (Hah)No, she ain't get no DM from me (Bitch)This rich nigga dick, it ain't freeShe be throwin' that ass, yeah, she good at itTurn around when we fuck, make her look at it (Uh, she like, hah)"
21,spotify:track:1Cv1YLb4q0RzL6pybtaMLo,Sunday Best,Surfaces,False,0.878,0.525,5.0,-6.832,0.0578,0.183,0.0,0.0714,0.694,112.022,76,"[Intro: Forrest]Good, feeling good[Chorus: Forrest]Ayy, feeling good, like I shouldWent and took a walk around the neighborhoodFeeling blessed, never stressedGot that sunshine on my Sunday best (Yeah, ayy, ayy)[Verse 1: Forrest]Every day can be a better day, despite the challengeAll you gotta do is leave it better than you found itIt's gonna get difficult to stand, but hold your balanceI just say whatever 'cause there is no way around it 'cause[Pre-Chorus: Forrest]Everyone falls down sometimesBut you just gotta know it'll all be fineIt's okay, uh-huh-huh, uhIt's okay, it's okay[Chorus: Forrest]Ayy, feeling good like I shouldWent and took a walk around the neighborhoodFeeling blessed, never stressedGot that sunshine on my Sunday best (Ayy)"
22,spotify:track:4PklAHGXT5ityno3IA8SKd,Go Stupid,Polo G,True,0.92,0.833,1.0,-3.18,0.253,0.0277,0.0,0.0596,0.645,141.034,78,"[Intro: Polo G]AyyGang, gang, gang, ayy (Mike WiLL Made-It)Lil' Capalot, bitch, hah(Tay Keith, fuck these niggas up)[Verse 1: Polo G & Stunna 4 Vegas]Hit the strip after school, couldn't wait 'til I got out of class, used to stare at the clock and shitBefore all of this rappin' shit, I was gangbangin' and doin' high-speeds on the cops and shitAnd I'm straight from the Chi, but I ball like a king up in Cali and shoot like StojakovićKeep applyin' that pressure, I go on the run, it ain't no lettin' it up, ain't no stoppin' thisHad to tell my lil' brother to chill, gotta stay in the house, come outside, he be poppin' shitYou ain't heard about us, well, you need to go watch the news, niggas know we be dropping shitGot the feds on my ass in the hood 'cause they think I'm the one who been buyin' up Glocks and shitI'm just focused on music, they say my last tape was a classic, but I got some hotter shit (Hotter shit)Might be rocking a show or if I'm not up the stu', then I'm fucking this cash offDon't you know Polo G? Skinny tall with the dreads, that lil' nigga be rappin' his ass offYeah, I heard she got surgery, still wanna clap from the back just to see if her ass softGo like Harden with rockets, we blast offTried to throw us some bullets, but we made 'em fumble, like nah, you ain't gettin' that pass offSpin the block, now I'm takin' my mask offHit the gas like we racin', speed off in them foreigns and leave tire marks on the asphaltIt's gon' be R.I.P. once your ass caughtHe like frontin', we knockin' his cap off'Nother day, a new chain or a MAC boughtAll this ice got me freezin' like Jack Frost (4X)"
23,spotify:track:6axvnGwB3rtoriGI1lPhTz,Chinese New Year,SALES,False,0.744,0.845,4.0,-7.422,0.253,0.759,0.232,0.1,0.749,75.221,52,"[Chorus]I'll see you at the moviesI see you with your lipstick onI'm looking out for cosmosI'm hoping that we get alongIt's time for innovationIt’s time for us to make a changeIt's time for a Chinese New YearIt's time for me to make a way[Refrain]And I can’t, no I can’t wait to get far from hereNo I can’t, I can’t wait to get out of hereNo I can’t, no I can’t, no I can’t wait to get out of here[Chorus]I'll see you at the moviesI see you with your lipstick onI'm looking out for cosmosI'm hoping that we get alongIt's time for innovationIt’s time for us to make a changeIt's time for a Chinese New YearIt's time for me to make a way[Verse]Sweared a lotAnd I bared a lotI was there a lotLast yearWept a lotOh, baby, you slept a lotI was left a lotLast yearPleased a lotBaby, you seized my heartAnd IStarted to fall last year"
25,spotify:track:3JTMWdhcJPiegDSe7SvZS3,Cannibal,Kesha,False,0.71,0.68,1.0,-4.676,0.106,0.0078,0.0165,0.0493,0.571,129.971,69,"[Intro]RrahRrah[Verse 1]I have a heart, I swear I doBut just not, baby, when it comes to youI get so hungry when you say you love me(Hush) If you know what's good for youI think you're hot, I think you're coolYou're the kinda guy I'd stalk in schoolBut now that I'm famous, you're up my anusNow I'm gonna eat you fool[Pre-Chorus]I eat boys up, breakfast and lunchThen when I'm thirsty, I drink their bloodCarnivore, animal, I am a cannibalI eat boys up, you better run[Chorus]I am cannibal (Cannibal, cannibal, I am)I am cannibal (Cannibal, I'll eat you up, I am)I am cannibal (Cannibal, cannibal, I am)I am cannibal (Cannibal, I'll eat you up)"
26,spotify:track:1dtTRXifeGC51adYy0902s,Bad Boy,Yung Bae,False,0.861,0.82,1.0,-4.807,0.0728,0.032,4.76e-06,0.0706,0.781,118.04,58,"[Verse 1: ​bbno$]Ayy, uh-huhYeah, I'm a bad boy doin' good thingsGot a lemonade whip, chicken wingsWith a bad bitch and she quite thickSo I might just cop myself a chain tonightSlim shawty with the tank topI'ma let her munch it on my cake pop, yeah-yeahYung Bae'll make your hips dropSo I might just take your woman for a night[Pre-Chorus: bbno$]Everybody in the whole buildingI said, everybody in the whole buildingCome on, follow along, feel the grooveAnd get yourself to moveGet your ass to the dance floorI said, get your ass to the dance floorCome on, follow along, feel the grooveYeah, there's no one to prove[Chorus: bbno$]Pick a girl, pick a boySpin 'em 'round like a toyGrab 'em hands, pull 'em closePush 'em back, do the most (I said)Pick a girl (Come on), pick a boy (Come on)Spin 'em 'round (Come on) like a toy (I said)Grab 'em hands (Come on), pull 'em close (Come on, all y'all)Push 'em back (Come on), do the most (Let's go)"
29,spotify:track:6wJYhPfqk3KGhHRG76WzOh,Blueberry Faygo,Lil Mosey,True,0.774,0.554,0.0,-7.909,0.0383,0.207,0.0,0.132,0.349,99.034,72,"[Intro]Damn, Callan (Damn, Callan)[Chorus]One bad bitch and she do what I say so (Yeah)Two big 40's and a big-ass Draco (Boom, boom)Three more millions when you ask how my day go (Yeah)Poured up a four, now that's blueberry Faygo (Lean)One false move and we straight to shootin' shitTwo small bands just to take you out real quick (Bands)Three more hoes, pull up, I'm fucking shit (Yeah)That's how it go, big bands, I'm thumbin' shitAyy, one bad bitch and she do what I say so (Yeah)Two big 40's and a big ass Draco (Boom, boom)Three more millions when you ask how my day go (Yeah)Poured up a four, now that's blueberry Faygo (Lean)One false move and we straight to shootin' shitTwo small bands just to take you out real quick (Bands)Three more hoes, pull up, I'm fucking shit (Yeah)That's how it go, big bands, I'm thumbin' shit[Verse 1]I'm with my niggas, yeah, we some rockstarsAnd I'm with my nigga, yeah, KK Wokhardt (KK Wokhardt)This not my dick, lil' bitch, my Glock hard (Lil' bitch)Straight to the cash (Cash), I'm a trapstarStraight to the bag (Bag), I'm that nigga, huh?Got me some gas, rollin' up somePfft, pfft, cash, yeah, I got me someI ain't fucked since yesterday, I'ma fuck somethin'"
32,spotify:track:1nwsqIhMaK6LAlSjhqt02x,Attention,Todrick Hall,True,0.858,0.908,1.0,-6.077,0.13,0.356,0.0,0.202,0.808,134.958,54,"[Hook]Do I have your attention (Hey!)Do I have your atten-tion (Hey, hey!)Do I have your attention (Hey!)Do I have your atten-tion (Hey, hey!)Do I have your attention (Hey!)Do I have your atten-tion (Hey, hey!)Do I have your attention (Hey!)Do I have your atten-tion (Hey, hey!)(Is you taking notes?)(Three, two, werk)[Verse 1]We about to go off, off, offWhen the speakers go blow, blow, blowEverybody turn up, up, upIt's about to go down, down, downMake the whole room spin, spin, spinTurn the base up loud, loud, loudWe about to go in, in, inAnd we can't stop now, now, now(Fuck it up)[Chorus](Dance!)Don't stop, don't stop, don't stop, don't stop, don't(Dance!)Don't stop, don't stop, don't stop, don't stop, don't(Dance!)Don't stop, don't stop, don't stop, don't stop, don'tDo I have your attention(Fuck it up)(Dance!)Don't stop, don't stop, don't stop, don't stop, don't(Dance!)Don't stop, don't stop, don't stop, don't stop, don't(Dance!)Don't stop, don't stop, don't stop, don't stop, don'tDo I have your attention"
33,spotify:track:2WgyOP8Z1D6GQYumCwH4Dk,Monster,Lady Gaga,True,0.694,0.801,9.0,-4.503,0.0441,0.00124,0.0,0.479,0.646,119.969,71,"[Intro]Don't call me GagaI've never seen one like that beforeDon't look at me like thatYou amaze meHe ate my heart, he a-a-ate my heart (You little monster)He ate my heart, he a-a-ate my heart out (You amaze me)Ate my heart, he a-a-ate my heart (Hahahaha)He ate my heart, he a-a-ate my heart (Big boy)[Verse 1]Look at him, ahLook at meThat boy is bad and honestlyHe’s a wolfIn disguiseBut I can't stop staring in those evil eyes (Evil eyes, evil eyes)[Pre-Chorus]I asked my girlfriend if she’d seen you 'round before (Oh yeah)She mumbled something while we got down on the floor, baby (Uh)""We might’ve fucked, not really sure, don’t quite recall (Oh yeah)But something tells me that I've seen him, yeah""[Chorus]That boy is a monster (Mo-mo-mo-monster)That boy is a monster (Mo-mo-mo-monster)That boy is a monster (Mo-mo-mo-monster)That boy is a monster-er-er-er-er"
35,spotify:track:4nK5YrxbMGZstTLbvj6Gxw,Supalonely,BENEE,True,0.863,0.631,7.0,-4.689,0.0534,0.305,3.04e-05,0.123,0.817,128.977,70,"[Chorus: BENEE]I know I fucked up, I'm just a loserShouldn't be with ya, guess I'm a quitterWhile you're out there drinkin', I'm just here thinkin''Bout where I should've beenI've been lonely, mmh, ah, yeah[Verse 1: BENEE]Water pouring down from the ceilingI knew this would happen, still hard to believe itMaybe I'm dramatic, I don't wanna seem itI don't wanna panic[Pre-Chorus: BENEE]I'm a sad girl in this big world, it's a mad worldAll of my friends know what's happened, you're a bad thing (Ah)[Chorus: BENEE]I know I fucked up, I'm just a loserShouldn't be with ya, guess I'm a quitterWhile you're out there drinkin', I'm just here thinkin''Bout where I should've beenI've been lonely, mmh, ah, yeah[Post-Chorus: BENEE]La-la-la-la, la-la-la-laLonely (I'm a lonely bitch)La-la-la-la, la-la-la-laLonely (Super lonely)"
36,spotify:track:78qd8dvwea0Gosb6Fe6j3k,Boss Bitch,Doja Cat,False,0.707,0.955,10.0,-4.593,0.222,0.127,0.0,0.202,0.575,125.989,80,"[Intro]MmmI ain't tryna (Ah)I ain't trynaI ain't tryna[Verse 1]Yeah, ain't tryna be cool like youWobblin' around in your high heel shoesI'm clumsy, made friends with the floorTwo for one, you know a bitch buy fourAnd two left feet, you know I always dropFirst thing a girl did was a bopI'm the whole damn cake and the cherry on topShook up the bottle, made a good girl pop[Pre-Chorus]You ain't even here to partyKen in the club, tryna pipe a BarbieI don't wanna go, go, go with the flowBackbend 'til I touch my toesI don't wanna row, row, row the boatWrist full of rocks and I hope I floatBig up yourself 'cause you know they don'tI chew, chew, chew, 'cause they hope I choke"
37,spotify:track:6uhvuMDb93ANzVxNABDgf1,Kill the Director,The Wombats,False,0.41,0.858,1.0,-5.301,0.0481,0.00354,0.0,0.0897,0.961,161.487,54,"[Verse 1]I've met someone that makes me feel seasickOh, what a skill to have, oh, what a skillTo have so many skills that make her distinctiveBut they're not mine to have, no, they're not mine[Pre-Chorus 1]Whenever she looks, I read the nearest paperThough I don't care about the soaps;No, I don't care about the soaps...Though I'm acting like I'm in an EastEnders episode![Chorus](Ooh, ooh, ooh, ooh)If this is a rom-com, kill the director!(Ooh, ooh, ooh, ooh)If this is a rom-com, kill the director, please![Verse 2]Carrots help us see much better in the darkDon't talk to girls; they'll break your heartAnd this is my head and this is my spoutBut they work together; they can't figure anything out[Pre-Chorus 2]So with the angst of a teenage bandHere's another song about a gender I'll never understandHere's another song about a gender I'll never understand"
38,spotify:track:7B2rgsfMqzDCwyChJn0TKr,3 Vets,The Future Kingz,True,0.918,0.602,11.0,-6.591,0.264,0.179,0.0,0.11,0.898,145.013,51,"[Intro: Renz]Yeah, yeah, yeah, yeah, ayy[Chorus: Renz & Lil Sosho]Walk up in dat bit' too clean, I’m froze (Froze)They don’t fight you where I’m fromLike the beat, I keep a drumYou ain’t got dough lil' boy, you a bum (Ayy)She gave me brain that bit' so dumb (So dumb)Used to be broke, I ain’t have no fundsNow I spend it just for funEat at Harold’s just for lunch (Ayy)Walk up in dis bitch wit da VVSCan’t get my 'Gram 'cause I don’t do the textDon’t give a damn 'bout how you flexPull up with cubans all over my neckTec gon' blam don’t care who nextSee me and kinfolk, you see three vetsI’m at the show, better have my checkChoppa gon' blow if you disrespect us[Verse 1: Renz]Choppa gon' blow if you disrespectLotta bad bitches wanna give me sexGang on my neck, gold chain wit da crestShe gon' buss it down on a boy then I dipYou a lil' bitch crying 'bout some credsHad a drop a roll and I got some breadsRenz gon' eat, whole gang get fedHatin on me? Lil' boy get slept (Slept)"
41,spotify:track:42EG9CclEoBnRq7X5B7O9j,My Heart Went Oops,Tiagz,False,0.96,0.412,1.0,-11.281,0.607,0.119,0.0,0.0903,0.49,121.027,48,"[Intro](Tiagz)Oops, my heart went[Chorus]Oops (Yeah)My heart just got stuck between these loops (Between these loops)My mind got stuck in between these groups (Groups, huh?)They don't want admit, but it's okay (Huh? Huh? Huh?)Now my heart knows how to stay away[Bridge]Right now it's like two in the morningAnd I can't make a lot of noise 'cause I don't want to wake up anybody like[Verse 1]Post on the 'Gram, everybody likingTurn the switch up, now I'm back to typing (Typing)One mil' on the 'Tube, I am back to shining (And I'm back to shining)They want some features, I'm not into pricingNow they be wanting something from meI don't mind 'cause I'm happy (Happy)I fight strong and rap, Killer BeeRasengan jutsu sharingan, yeahBands, bands, bands, that's all they want (That's all they want, yeah)Bands, bands (My heart went)"
