,uri,track_name,artist,explicit,danceability,energy,key,loudness,speechiness,acousticness,instrumentalness,liveness,valence,tempo,popularity,lyrics
47,spotify:track:1G5ho820Xi2Qu3HsBZ26ft,Womp Womp,Valee,True,0.877,0.558,1,-4.896,0.342,0.066,0.0,0.0745,0.493,157.027,53,"[Intro](Cássio)[Chorus: Jeremih]Hey, womp-womp, womp-wompShe give me what I wannaBall so hard, need a warmupI bagged her at the Walmart (Yeah)Big timer, stunner (Woo)I'm out here on the come upI beat the pussy, drummerI roll up, no more drama (Yeah)Womp-womp, womp-wompShe give me what I wannaBall so hard, need a warmupI bagged her at the Walmart (Yeah)Big timer, stunner (Woo)I'm out here on the come up (Woo)I beat the pussy, drummerI roll up, no more drama (Woo)[Verse 1: Jeremih]Ayy, super stunt dummy should be in the Special Olympics (Well)Pockets so fat that I need Bally Total Fitness (Well)Feet so fat, I hit the pedal, blew the engineV12, duckin' 12 like license is suspended (Hey)She's a slobber, all on my knob, corn the cobberAyy, sweet thing and that pussy taste like peach cobblerI'ma never ever take her to meet mamaJust got a lineup and just added two more to my lineup (Hey)Big money, why you always standin' on your wallet?Profit, I just made another one, I'm KhaledStop it, they asked me what I do with my stacksJust bought a new wall for plaques and a new broad for some smacks"
51,spotify:track:1du4tPkvJfCIuVL6WMtqSs,Boys,Lizzo,False,0.892,0.588,1,-4.287,0.11,0.00319,0.000162,0.0498,0.753,120.042,62,"[Verse 1]Ayy, boy, whatcha say, boy?You tryna play coy like a Gameboy?Hit my phone boy, is you home boy?Are you alone boy? Come give me dome, boyGot a boy with degrees, a boy in the streetsA boy on his knees, he a man in the sheetsSheesh, it's all Greek to meGot this boy speaking Spanish, ay, papi[Pre-Chorus]Baby, I don't need youI just wanna freak youI heard you a freak tooWhat's two plus two? (Four, three, two, ow)[Chorus]Boys, boys, boysMake a girl go crazy (Four, three, two, ow)Boys, boys, boysMake a girl go crazy (Four, three)[Verse 2]I like big boys, itty bitty boysMississippi boys, inner city boysI like the pretty boys with the bow tieGet your nails did, let it blow dryI like a big beard, I like a clean faceI don't discriminate, come and get a tasteFrom the playboys to the gay boysGo and slay, boys, you my fave boys"
52,spotify:track:3B9vJvi2Z6ws4wjNTQMYAc,Mia Khalifa,iLOVEFRiDAY,True,0.812,0.525,1,-8.798,0.124,0.255,0.0,0.325,0.564,145.016,65,"[Intro]X-X-X-Xeno Carr![Chorus: Xeno Carr]Who do you think you are?You were sucking dick for a foreign car (Brr-rrr-rrr)Gotta take that callThey want you at work, so girl, go do your job[Bridge: Xeno Carr](Mia!) Mia Khalifa(Mia!) Mia Khalifa(Mia!) Mia Khalifa(Mia!) Mia Khalifa(Mia!) Mia Khalifa(Mia!) Mia Khalifa(Mia!) Mia Khalifa[Verse 1: Xeno Carr]We all have regrets sometimesWe wish to go back in time(Body, body, body, body) That's a lot of lives(Video, video) That's a lot of guys, damnDon't you wish you changed your past?'Cause it's so badDon't you wish you changed your past?'Cause it's so badMia KhalifaIs that why you tried to quit three times?Is that why you said goodbye, retired?Is that why you said, ""Fuck these guys""?"
53,spotify:track:1F1QmI8TMHir9SUFrooq5F,Buff Baby,tobi lou,True,0.734,0.765,5,-6.047,0.0571,0.243,0.0,0.101,0.512,156.04,56,"[Intro]Like a manGot the yams, yams, yamsThe Sedan, yesThink that I can[Chorus]I'm a buff baby but I dance like a man (Like a man)She a nice lady and she shakin' the yams (got the yams, yams, yams)Spent the whole summer trappin' out the Sedan (The Sedan)Marching with the bands 'cause I think that I can (Think that I can)(Like a man)[Verse 1]I'm a lover, not a fighter but I'll never let you flex on me (Like the yams, yams, yams)(Yeah, never)Broke my heart about a while ago baby got the best of me (The sedan, think that I can)(Best, whatever)(Like a man)Momma told me fuck these hoes get that dough that's the remedy (Like the yams, yams, yams)(Yeah, momma)So now I'm smokin' all my veggies and I'm countin' all my celery (The Sedan, think that I can)(Yeah, yeah, celery)(Like a man)Same pants every day like these were my only jeans(Like the yams, yams, yams)(Yeah, yeah, only jeans)(The Sedan)Takin' shot after shot like I'm tryna win the MVP(Think that I can)(Yeah, yeah, MVP)(Like a man)Might change my name to Kobe (Kobe)Bitch, I'm Kobe Lou (Like the yams, yams, yams)Who are you? (The Sedan)Whoa, who are you? (Think that I can)"
54,spotify:track:755inykyaG4w22GWAsA3MX,Marlboro Nights,Lonely God,False,0.466,0.823,2,-6.635,0.311,0.00237,0.000321,0.332,0.782,175.797,76,"[Intro]Two, three, four[Verse]I don't want to go to school tomorrow I can't studyThinking about you and you know I always doI don't want to go to sleep tonight when I can stay upThinking about you and you know I always do[Chorus]Marlboro Nights(Just say the word, just say the word)(Just say the word, just say the word)Marlboro Nights(Just say the word, just say the word)(Just say the word, just say the word)[Outro]La, da, da-da, la, da, da, daLa, da, da-da, la, da, da, daLa, da, da-da, la, da, da, daLa, da, da-da, la, da, da, daLa, da, da-da, la, da, da, daLa, da, da-da, la, da, da, daLa, da, da-da, la, da, da, daLa, da, da-da, la, da, da, daLa, da, da-da, la, da, da, daLa, da, da-da, la, da, da, daLa, da, da-da, la, da, da, daLa, da, da-da, la, da, da, da"
56,spotify:track:7pBrj5rt4SSxXwFKOyZfHR,Dissolve,Absofacto,False,0.688,0.582,6,-10.668,0.0542,0.23,0.000157,0.0663,0.872,85.486,64,"[Verse 1]No flask can keep itBubble up and cut right throughBut you're someone I believe inYou heat me like a filamentAnytime you're in the roomBut you burned me and I'm smoking[Chorus]I just wanted you to watch me dissolve, slowlyIn a pool full of your loveBut I don't even know how the chemistry worksWhen you're poolsideKicking in the dirt, kicking in the sandAnd stirring up trouble[Verse 2]Can't find an exitI wander in a maze aloneIf I find you will you shock me?Left, left and right, rightPretty sure that I've been here beforeAnd it isn't what I wanted[Chorus]I just wanted you to watch me dissolve, slowlyIn a pool full of your loveBut I don't even know how the chemistry worksWhen you're poolsideKicking in the dirt, kicking in the sandAnd stirring up trouble"
57,spotify:track:34TufQ4EFzmDIFXJ3A8Yau,Flamingo,Kero Kero Bonito,False,0.788,0.49,8,-6.29,0.511,0.311,0.0,0.0968,0.791,177.865,57,"[Intro]How many shrimps do you have to eatBefore you make your skin turn pink?Eat too much and you'll get sickShrimps are pretty rich[Verse 1]なんであいつらはピンク？動物園で思ったピンク食べ物でそうなんだ実は私はたらこが大好きプラス海老カニ食べようピンク色になるの？だから皆違う色人間って勘違いしてるよね[Chorus]Black, white, green or blueShow off your natural hueFlamingo, oh, oh, ohIf you're multicolored, that's cool tooYou don't need to changeIt's boring being the sameFlamingo, oh, oh, ohYou're pretty either way"
58,spotify:track:5k9CZnMvbTryKroi1tkp2S,Who R U,Jufu,False,0.925,0.337,1,-13.445,0.41,0.0135,0.0,0.065,0.529,91.478,40,"[Intro]Hold up, wait wait waitWait wait wait, stop, stopThis doesn't make senseHold up, wait (Ouu)[Chorus]Who are you? (Uh huh)I am you (What)I am meNo sir, you are you (Wait)I dunno (Um)Two is twoGot two buss downs, diamonds blue (Yeah)Five milly dollars for a deal? That’s cool (Uh huh)I wanted seven, label said, ""Minus two"" (Grrt)Fat cheque, satisfied, I guess that'll do (Yeah)Big guap, gratified, getting to the loot (Bow)[Verse 1]Run it back thoWhy they always tryna copy me (What)Be like meI said you are youBut you said you're me (What)Honestly, yes I got the dripNow you follow me (Yeah)Tryna be, tryna be like meYou aspiring (Ouu)"
59,spotify:track:0WKmVAD4VWk5EdTyCFILi4,Needs,Verzache,False,0.813,0.601,11,-7.552,0.116,0.189,0.0002,0.426,0.855,118.981,66,"[Chorus]Enjoy yourself, enjoy yourselfJust leave me for somebody elseEnjoy yourself, enjoy yourselfJust leave me for somebody elseEnjoy yourself, enjoy yourselfJust leave me for somebody elseEnjoy yourself, enjoy yourselfJust leave me for somebody elseEnjoy yourself, enjoy yourselfShe doesn't need nobody elseEnjoy yourself, enjoy yourselfShe doesn't need nobody else[Verse]What's your name, let me out pleaseYou know I love you, you're my dime pieceDon't stop, baby don't pleaseFor my enemies, don't unleashAnd I'll be sitting on the throne nowAs I'm dyingI'll be thinking about your face nowWhen I can't remember all days nowAll days that we've been trying to forget aboutHow-"
60,spotify:track:5iFwAOB2TFkPJk8sMlxP8g,Make You Mine,PUBLIC,False,0.606,0.799,9,-4.452,0.0261,0.0128,0.0,0.15,0.638,103.014,76,"[Verse 1]Well, I will call you darlin' and everything will be okay'Cause I know that I am yours and you are mineDoesn't matter anywayIn the night, we'll take a walk, it's nothin' funnyJust to talk[Chorus]Put your hand in mineYou know that I want to be with you all the timeYou know that I won't stop until I make you mineYou know that I won't stop until I make you mineUntil I make you mine[Verse 2]Well, I have called you darlin' and I'll say it again, againSo kiss me 'til I'm sorry, babe, that you are gone and I'm a messAnd I'll hurt you and you'll hurt me and we'll say things we can't repeat[Chorus]Put your hand in mineYou know that I want to be with you all the timeYou know that I won't stop until I make you mineYou know that I won't stop until I make you mineUntil I make you mine"
63,spotify:track:6MYJv37Mpj5njLLbxKWNun,Crush,Tessa Violet,False,0.91,0.402,1,-9.55,0.0857,0.0297,0.00018,0.0801,0.825,135.993,64,"[Intro]Uh, alright[Verse 1]I can't focus on what needs to get doneI'm on notice hoping that you don't run, ahYou think I'm tepid but I'm misdiagnosed'Cause I'm a stalker, I seen all of your posts, ah-ah[Pre-Chorus]And I'm just tryna play it cool nowBut that's not what I wanna do nowAnd I'm not tryna be with you now, you nowMhm[Verse 2]You make it difficult to not overthinkAnd when I'm with you I turn all shades of pink, ahI wanna touch you but don't wanna be weirdIt's such a rush, I'm thinking wish you were here, ah-ah[Pre-Chorus]And I'm just tryna play it cool nowBut that's not what I wanna do nowAnd I'm not tryna be with you now, you now"
64,spotify:track:0EKbMWOt2ZwdEcqgRpLHaC,Asshole,hooligan chase,True,0.748,0.802,5,-6.271,0.113,0.595,0.000678,0.113,0.874,159.984,53,"[Intro]Ayy, hahahaI got gas, but I ain't been eatin' beansWait, wait, I been eatin' beansHahahaWhoa, hey (Ayy)Whoa, hey (Ayy)[Chorus]Baby, I'm a bad boy, I might hurt youI need a therapist and a perc tooI need a cash flow, you fuck with fat hoes (You do)I ain't got no drugs, I'm turnin' to an assholeOn the stove, cookin' eggs, need a new pan (Brr)She a pro with the head, she don't use handsI need hunnids in the sky and a blue tintYou ain't on the family tree, who is you, fam?[Verse]I be itchin' for the pack, I'm a dope fiendI drink thot blood, what the fuck is codeine?Ayy, what the fuck is codeine?Yo' baby mama learned some tricks and tryna show me (Ayy)Truth is I don't really fuck with these hoes (Big facts)I just fuck with these hoes when I wan' fuck with these hoes (Big facts)And my dick go right in they muh'fuckin' noseAnd if they ain't with that way, then it go right through they toesI don't pop a Xan for the cultureYo' bitch suck me dead like a vultureWorkin' with my wood like a sculptor (That's some fire)Big booty hoes charmin ultra"
66,spotify:track:58IHCvoCPfMNS0WrK7JnSg,Gm Say It Back,Killua the Pilgrim,True,0.689,0.405,8,-12.525,0.171,0.733,4.8e-05,0.54,0.423,77.54,27,"[Intro]YooThis song is for my sad niggasYou know, the type of niggas to listen to Lil Peep, and Juice WRLDYuh, aye, what?[Hook]Good morning bitch, say it back, aye (Yuh)Good morning bitch, say it back, yuh (Woah)Good morning bitch, say it backI hit you up, and you don't hit me back[Verse]Told a bitch good morning ’bout a year ago (Yes I did)Still waiting for a reply from that silly hoe (I really am)If I ever get it, Imma nut like a cheerio (Cheerio)If I ever fuck her, Imma tell that bitch, ""Cheerio!""Why that little hoe wanna treat me like John CenaDon't leave me on read just to fuck with my demeanorEvery time I see her, I'm reminded of the subjectAnd every time we talk there’s a little bit of somethin' (Nico nico niiiii)[Bridge]I got my heart broken by a silly thotty (Okay)She drove a nigga crazy like a Maserati (Vroom vroom)I don't even really wanna say I'm fuckin' sorryBut I'm laughably pathetic so I'll hit her in the morning with a"
67,spotify:track:0OFknyqxmSQ42SoKxWVTok,Un Poco Loco,Anthony Gonzalez,False,0.62,0.496,7,-7.509,0.133,0.597,1.36e-05,0.322,0.636,126.032,72,"[Verse 1: Miguel]What color is the sky? Ay, mi amor, ay, mi amorYou tell me that it's red, ay, mi amor, ay, mi amorWhere should I put my shoes? Ay, mi amor, ay, mi amorYou say, ""Put them on your head!"", ay, mi amor, ay, mi amorYou make me un poco loco, un poquititito locoThe way you keep me guessing, I'm nodding and I'm yes-ingI'll count it as a blessing that I'm only un poco loco[Verse 2: Hector, Miguel, Both]The loco that you make me, it is just un poco crazyThe sense that you're not makingThe liberties you're takingLeaves my cabeza shakingYou're just un poco loco[Bridge: Ensemble]He's just un poco crazy, leaves my cabeza shakingHe's just un poco crazy, leaves my cabeza shakingHe's just un poco crazy, leaves my cabeza shakingHe's just un poco crazy, leaves my cabeza shaking[Outro: Miguel & Hector]Un poquititititititititi-titititito loco!"
68,spotify:track:53yWQ1FObrwPlVYCZdR6es,Liar,BigKlit,True,0.883,0.492,7,-12.118,0.354,0.339,0.0,0.166,0.59,94.959,47,"[Intro]Whistles out, in the cut‚ goin' Full Tac[Chorus]Lyin' on your dick‚ lyin' on your dick (Liar)Why you lyin' on your dick‚ lyin' on your dick? (Liar)Why you lyin' on your dick, lyin' on your dick? (Cap)He be talkin' shit 'cause he just wanna hit (I know)Why you lyin' on your dick, lyin' on your dick? (Liar)Why you lyin' on your dick‚ lyin' on your dick? (Cap)Why you lyin' on your dick, lyin' on your dick? (Bitch)He be talkin' shit 'cause he just really wanna hit (Uh, uh‚ uh)[Verse 1]Ah, I smell capHe say he like cat, but that is not a factHe keep it in the closet, he keep it under wrapsThe only thing my closet got is straps[Pre-Chorus]Fuck, you a pussy ass bitch (You goose)Fuck you, your mama, and your kids (All of 'em, stupid)I hate a lyin' ass trick (Bitch)Always lyin' on his dick, you pussyWhy you gotta lie?You know that you a liarSo insecure insideBe a real nigga, only bitch niggas lie, ah"
69,spotify:track:3HWzoMvoF3TQfYg4UPszDq,Truth Hurts,Lizzo,True,0.715,0.624,4,-3.046,0.114,0.11,0.0,0.123,0.412,158.087,75,"[Intro]Why men great 'til they gotta be great?Woo![Verse 1]I just took a DNA test, turns out I'm 100% that bitchEven when I'm crying crazyYeah, I got boy problems, that's the human in meBling bling, then I solve 'em, that's the goddess in meYou coulda had a bad bitch, non-committalHelp you with your career just a littleYou're 'posed to hold me down, but you're holding me backAnd that's the sound of me not calling you back[Chorus]Why men great 'til they gotta be great? ('Til they gotta be great)Don't text me, tell it straight to my face (Tell it straight to my face)Best friend sat me down in the salon chair (Down in the salon chair)Shampoo press, get you out of my hairFresh photos with the bomb lighting (With the bomb lighting)New man on the Minnesota Vikings (Minnesota Vikings)Truth hurts, needed something more exciting (Yee)Bom bom bi dom bi dum bum bay (Eh, yeah, yeah, yeah)[Verse 2]You tried to break my heart?Oh, that breaks my heartThat you thought you ever had itNo, you ain't from the startHey, I'm glad you're back with your bitchI mean, who would wanna hide this?I will never, ever, ever, ever, ever be your side chickI put the sing in singleAin't worried 'bout a ring on my fingerSo you can tell your friend, ""Shoot your shot"" when you see himIt's okay, he already in my DMs"
73,spotify:track:6IPwKM3fUUzlElbvKw2sKl,we fell in love in october,girl in red,False,0.566,0.366,7,-12.808,0.028,0.113,0.181,0.155,0.237,129.96,88,"[Verse 1]Smoking cigarettes on the roofYou look so pretty and I love this view[Pre-Chorus]We fell in love in OctoberThat's why, I love fallLooking at the starsAdmiring from afar[Chorus]My girl, my girl, my girlYou will be my girlMy girl, my girl, my girlYou will be my worldMy world, my world, my worldYou will be my girl[Verse 2]Smoking cigarettes on the roofYou look so pretty and I love this viewDon't bother looking downWe're not going that wayAt least I know, I am here to stay[Pre-Chorus]We fell in love in OctoberThat's why, I love fallLooking at the starsAdmiring from afar(My girl, my girl, my girl)"
75,spotify:track:1PNBqEIxQmeyP2uqpWtV2M,Gordon Ramsay,HL Wave,True,0.883,0.732,10,-7.133,0.343,0.0207,0.0,0.199,0.808,74.984,42,"[Intro: HL Wave]Jhonny Flames productionsMove your fat fuckin' assShe can't clap without her hands?(What did you say?)Nah, you can keep that ho(What?)[Chorus: HL Wave]If she can't clap without her hands, then I don't want that bitchI feel like Gordon Ramsay how I flick my fucking wristIf your ho spam my inbox, then I block her quickAll this jewelry on me, so I keep a stick (Yeah, yeah)Bitch, I flick my wrist (Huh?)Yeah, I flick my wrist (Huh?)Bitch, I flick my wrist (Yeah)Yeah, I flick my wrist (What?)Bitch, I keep my stick (Yeah)Yeah, I keep my stick (Huh?)Bitch, I keep my stick (Yeah)Yeah, I keep my stick (Yeah, yeah)[Verse 1: HL Wave]Okay, like pop outBitch, you know I keep it on meWe in the drop nowYou know that this shit is not freeShe giving slop (Huh?)40, let it pop (Yeah)Fuck her, then I swap (Swap)Fuck her in the drop, yeah (Drop)Okay like, run to the back, go faster (Huh?)She tryna smash, I will not let herOkay like baby got back, big rack too (What?)So no bitch, I will not dead her, yeahStay with the strap, I'm poppin' (Damn)Nigga talk down, lay his ass in the coffin (Yeah)Knock you off the map for cappin' (What?)You lame bitch, chopper get to blastin'"
77,spotify:track:1nrsFfACPG4Hnw5AuOpCND,Smack a Bitch,Rico Nasty,True,0.703,0.7,2,-2.417,0.221,0.0055,0.0,0.115,0.34,169.861,58,"[Intro]Yeah! Yeah!(Rico)Kenny BeatsSugar Trap!(Rule #1)[Verse 1]Don't worry 'bout a bitch who never been in your place (Huh?)Always move in silence, never question your fate (Rule #2)Always check in on ya niggas, gotta make sure they straightIf I'm gettin' money, then you know we all got a plateSince a baby in her tummy mama knew I was greatThey can't play me like a dummy, they know what not to takeFuck these niggas 'cause the money only thing I'ma chaseTime is precious, that's the only thing I try not to wasteShe hatin' 'cause I'm up, you can tell on her faceI been eatin' so much, I been sayin' my graceWhen the times was rough, I would look up and prayThank God I ain't have to smack a bitch today[Chorus]Oh my fucking God, smack a bitch todayThank God I ain't have to smack a bitch todayYeah! Smack a bitch todayThank God I ain't have to smack a bitch today (Huh?)Yeah, woah, smack a bitch todayThank God I ain't have to smack a bitch todayHuh? Smack a bitch todayThank God I ain't have to smack a bitch today"
78,spotify:track:6HJxxqHWMdidwTVZmZWeHU,New Flesh,Current Joys,False,0.62,0.594,9,-16.066,0.0383,0.887,0.5,0.0917,0.698,165.861,74,[Verse 1]I listened to The CureI listened to The CureI listened to The Cure and then I criedI watched VideodromeI watched VideodromeI watched Videodrome and lost my mindI tried to write a songI tried to write a songI tried to write a song I think you'd likeBut no one gives a shitNo one gives a shitNo one gives a shit about my life[Chorus]'Til I die'Til I dieIt's DIYIt's DIY[Verse 2]I have nightmaresI have nightmaresI have nightmares all the timeSo I stay awakeSo I stay awakeSo I stay awake all nightI say I'm gonna leaveI say I'm gonna leaveI say I'm gonna leaveBut I think you're rightI'm gonna stay right hereI'm gonna stay right hereI'm gonna stay right here until I die
80,spotify:track:5ACZOGjT6I5He0pDZED56Z,Wannabe,why mona,False,0.578,0.724,6,-7.02,0.0865,0.192,2.38e-05,0.235,0.465,169.827,67,"[Intro]Yeah, I'll tell you what I want, what I really really wantSo tell me what you want, what you really really wantI'll tell you what I want, what I really really wantSo tell me what you want, what you really really wantI wanna, I wanna, I wanna, I wannaI really really really wanna zigazig ahI wanna, I wanna, I wanna, I wannaI really really really wanna zigazig ah[Verse 1]If you want my future forget my pastIf you wanna get with me better make it fastNow don't go wasting my precious timeGet your act together we could be just fine[Pre-Chorus]If you wanna be my lover, you gotta get with my friendsMake it last forever, friendship never endsIf you wanna be my lover, you have got to giveTaking is too easy, but that's the way it is[Chorus]Yeah, I'll tell you what I want, what I really really wantSo tell me what you want, what you really really wantI wanna, I wanna, I wanna, I wannaI really really really wanna zigazig ah"
82,spotify:track:0sVcnEo2jnUnr3p7uVDZ9o,Walk,Comethazine,True,0.828,0.795,1,-6.188,0.26,0.228,0.0,0.307,0.739,160.099,66,"[Intro]PHLEXNAyy, ayy[Chorus]I walk around like that nigga, finger on the triggerIf a nigga want some smoke, I let this choppa eat his liver (Boom)I came with the .38, I'm leavin' with a bodyIf he try me, do him sloppy, shootin' out the big body (Raah)I walk around like that nigga, finger on the triggerIf a nigga want some smoke, I let this choppa eat his liver (Boom)I came with the .38, I'm leavin' with a bodyIf he try me, do him sloppy, shootin' out the big body (Raah)[Verse]Ayy, pop out on a pussy (Boom), nigga, what the fuck up? (Ayy)Gas pack strong as fuck, my blunt be doing push-ups (Push-ups)If you 'bout that action, tell that pussy nigga buck up (Buck up)You be talkin' hella tough on Twitter, pull the fuck up (Ayy)My bustdown be shinin' like some glitter, but it's VV (Ayy)Murk a nigga, put him on the news, he on TV (Ayy)I got all this ice 'cause I'm a goddamn celebrity (Ayy)Bustdown demon on my motherfuckin' Cuban link[Chorus]I walk around like that nigga, finger on the triggerIf a nigga want some smoke, I let this choppa eat his liver (Boom)I came with the .38, I'm leavin' with a bodyIf he try me, do him sloppy, shootin' out the big body (Raah)I walk around like that nigga, finger on the triggerIf a nigga want some smoke, I let this choppa eat his liver (Boom)I came with the .38, I'm leavin' with a bodyIf he try me, do him sloppy, shootin' out the big body (Raah, boom)"
83,spotify:track:1lOe9qE0vR9zwWQAOk6CoO,Ransom,Lil Tecca,True,0.745,0.642,7,-6.257,0.287,0.0204,0.0,0.0658,0.226,179.974,83,"[Intro]Turn you to a dancerYeahInternet Money, bitch[Chorus]I got black, I got white, what you want?Hop outside a Ghost and hop up in a PhantomI know I'm ’bout to blow, I ain't dumbThey try to take my flow, I take they ass for ransomI know that I'm goneThey see me blowin’ up, now they say they want someI got two twin Glocks, turn you to a dancerI see two twin opps, leave 'em on a bannerAnd I got two thick thots, wanna link the gang, yeah[Verse]I got red, I got blue, what you want?The Chanel or Balenciaga, Louis and VuittonShe know I got the Fendi, Prada when I hit MilanI needed me a die or rider, I need me the oneI started from the bottom, you could see the way I stuntI want all the diamonds, I want that shit to weigh a tonThe opps, they tryna line me 'cause they hate the place I'm fromBut them niggas don't know me, they just know the place I'm fromI got lots of shawties tryna pull up to my placeBut you ain't want me last year, so just get up out my faceThey all up in my inbox, so I know they want a tasteI know they want my downfall, lil' nigga, are you laced?"
84,spotify:track:1000nHvUdawXuUHgBod4Wv,Panini,Lil Nas X,False,0.703,0.594,5,-6.146,0.0752,0.342,0.0,0.123,0.475,153.848,72,"[Intro: Nessly]D-D-Daytrip took it to ten (Hey)[Verse 1]Ayy, Panini, don't you be a meanieThought you wanted me to go upWhy you tryna keep me teeny? IIt's a dream, he wished it on a genieI got fans finally, ain't you wanting them to see me? I[Refrain]I thought you want this for my life, for my lifeSaid you wanted to see me thrive, you lied[Chorus]Just say to me what you want from meJust say to me what you want from me[Verse 2]Ayy, Panini, don't you be a meanieThought you wanted me to go upWhy you tryna keep me teeny now?Now they need me, number one on streamingOh yeah, you used to love meSo what happened, what's the meaning? I"
86,spotify:track:5KBARWIxeMGkvUax9VtVC9,My Type,Saweetie,True,0.899,0.811,2,-6.294,0.258,0.000677,0.0,0.0672,0.587,105.038,71,"[Intro]Hennessy on my lips, take a little sipPrivacy on the door, I'ma make the shit grip[Chorus]Rich nigga, eight-figure, that's my typeThat's my type, nigga, that's my typeEight-inch big, ooh, that's good pipeBad bitch, I'ma ride the dick all nightRich nigga, eight-figure, that's my typeThat's my type, nigga, that's my typeEight-inch big, ooh, that's good pipeThat's my type, nigga, that's my type[Post-Chorus]New wrist, new whip, ride around dippedI can see why all these basic hoes pissed[Verse 1]Bust down wrist, not a bust down bitch (Ah)Said I want your man, no the fuck I don't, sis (Uh, uh)If he a rich nigga, why he still hitting licks? (Licks)Nigga spending bread but he still can't hitBitch please (Bitch), Lamborghini keysPussy dripping ice, he get flown out to meBitch please, I want a man with the Bs (Yeah)Pussy from the Bay, goin' dumb on the D (Hahaha)"
