,uri,track_name,artist,explicit,danceability,energy,key,loudness,speechiness,acousticness,instrumentalness,liveness,valence,tempo,popularity,lyrics
237,spotify:track:2gam98EZKrF9XuOkU13ApN,Promiscuous,Nelly Furtado,False,0.768,0.782,7.0,-5.545,0.141,0.0545,0.0,0.338,0.842,116.492,66,"[Intro: Nelly Furtado, Timbaland]Am I throwin' you off?NopeDidn't think so[Verse 1: Nelly Furtado & Timbaland]How you doin', young lady?That feeling that you giving really drives me crazyYou're dope, have a player 'bout to chokeI was at a loss for words first time that we spokeYou lookin' for a girl that'll treat you right?How you lookin' for her in the daytime with the light?You might be the type if I play my cards rightI'll find out by the end of the nightYou expect me to just let you hit it?But will you still respect me if you get it?All I can do is try, gimme one chance (Chance)What's the problem? I don't see no ring on your hand (Hand)I'll be the first to admit itI'm curious about you, you seem so innocentYou wanna get in my world, get lost in it?Boy, I'm tired of runnin', let's walk for a minute[Chorus 1: Nelly Furtado & Timbaland]Promiscuous girl, wherever you areI'm all alone, and it's you that I wantPromiscuous boy, you already knowThat I'm all yours, what you waiting for?Promiscuous girl, you're teasin' meYou know what I want, and I got what you needPromiscuous boy, let's get to the point'Cause we're on a roll, you ready?"
239,spotify:track:4qBMiRsJjtm1WR4KyAQqrX,Oh No,Kreepa,True,0.744,0.619,0.0,-9.805,0.039,0.598,0.00372,0.231,0.641,112.997,81,"[Intro: The Shangri-Las]Whatever happened toThe boy that I once knew?The boy who said he'd be true[Verse 1: Kreepa & The Shangri-Las]Are you fuckin' with me? (Oh no)You smoke weed? (Oh no)Nigga, please (Oh no, no, no, no, no)Tell me, are you on? (Oh no)You smoke strong? (Oh no)Your money long? (Oh no, no, no, no, no)Do you got racks? (Oh no)You got tax? (Oh no)Your city on the map? (Oh no, no, no, no, no)You niggas killin' (Oh no)You niggas robbin' (Oh no)You be ballin' (Oh no, no, no, no, no)Are you fuckin' with Kreepa? (Oh no)You spit ether? (Oh no)Colder than a freezer (Oh no, no, no, no, no)You a rapper (Oh no)Am I a slacker? (Oh no)Give me an answer (Oh no, no, no, no, no)Bitch"
240,spotify:track:7B3z0ySL9Rr0XvZEAjWZzM,Sofia,Clairo,False,0.913,0.391,4.0,-11.158,0.368,0.272,0.0,0.0666,0.713,141.05,54,"[Chorus]I think we could do it if we triedIf only to say you're mineSofia, know that you and IShouldn't feel like a crimeI think we could do it if we triedIf only to say you're mineSofia, know that you and IShouldn't feel like a crime[Verse 1]You know I'll do anything you ask me toBut, oh my God, I think I'm in love with youStanding here alone nowThink that we can drive aroundI just wanna sayHow I love you with your hair downBaby, you don't gotta fightI'll be here 'til the end of timeWishing that you were minePull you in, it's alright[Chorus]I think we could do it if we triedIf only to say you're mineSofia, know that you and IShouldn't feel like a crime"
242,spotify:track:1S1bZVv8sqYY39S6KWchuk,Papi Chulo,Octavian,True,0.798,0.649,9.0,-6.546,0.306,0.0746,1.34e-05,0.517,0.566,142.006,75,"[Intro](Bricks, this shit finna kill these niggas)(Go Grizz)(Kio, Kio)[Verse 1: Skepta]Uh, met this pretty ting, nice to meet you, mucho gustoاوه،این خوشگله رو ملاقات کردم،از دیدنت خوشبختم،دارم لذت میبرم(از دیدنش لذت میبره)Sweeter than a churro, she call me Papi Chuloاز چورو* شیرین تره(منظورش اون دخترست که از چورو هم زیباتر و جذاب تره)،بهممیگه پاپی چولو(یعنی ددیه(daddy) دلال و خلافکار)*چورو:یک میان وعده در اسپانیایی،پرتغالی و کلا امریکای لاتین هست که حالت شیرینی سرخ شده دارهYeah, I'm single, baby girl, but how 'bout you though?آره من سینگلم بیبی گرل،تو چطور؟Tryna make you my number one, tryna make you my numero unoدارم سعی میکنم تو رو تو رتبه اولام قرار بدم،دارم سعی میکنم واسم مهم ترین آدم شی و بزارم تو لیست بهترینام[Chorus: Octavian]Sweet, sweet, sweet, sweetSweet, sweet, sweet, sweet-sweetSweet, sweet-sweet, sweet, sweetSweet, sweet, sweet, sweetSweet, sweet, sweet-sweetSweet, sweet-sweet, sweet, sweet, sweet""شیرین..شیرین‌.."""
243,spotify:track:3DWjFSDEQ9IWz1mj449fB7,Get Back,Pop Smoke,True,0.906,0.583,8.0,-7.721,0.317,0.0569,0.0,0.126,0.829,129.056,71,"[Intro]Traphouse MobYoz, what you tellin' me? (Yeah)What you tellin' me? YeahI got stacks to the right of meI got Mikey to the left of me, huh, waitWooLook, lookAyy, what up?Hold on, what they talkin' 'bout? Hey, what them folks talkin' 'bout?Huh, look, huh[Verse]Buddy gon' grrt that, grrt that, brrt that, brrt thatSend shots, make 'em get backAll that chit-chat, chit-chat, riff-raff, riff-raffMy niggas ain't into thatNigga be talkin' hot, but he ain't on shit (Woo)I got like fifty rounds up in this clipIf I go to jail, nigga, I'll plead the Fifth (Uh)'Cause mommy still gon' love her kidNiggas tryna lock me up and give me a bid, huh?I'm like nigga, fuck the pigsThe judge like, ""Why you actin' like a dick?""I said, ""I'm movin' like I'm Steven Vic""My lawyer like, ""Papi, why you brazen?""I said, ""I pop a Perc' and feel amazin'""I shoot for the stars, I'm a foundation, huhLook at the money I'm raisin'She wanna fuck, hold onShe snuck in the book, have her wait for arraignmentShe get dick and edible arrangementsThat's the only form of paymentShawty a snackAnd after I snack, I'ma blow out her backShe like, ""Papi, you so crazy,"" huhI told her, ""Wine on me, baby"" (Woah)She want a starShe wanna fuck 'cause she know who we areThese hoes be dirty, I ain't hittin' 'em rawWhen it come to hoes, I got bitches galore (Grrt, woo)She wanna grip that, lick that, ask where the stick atFreak bitch put my dick where her lips at (Woo)She goin' all gas, no chit-chat (Ayy)She goin' all gas, no chit-chatAyy, bah-bah-ba-bum (Bum)Here come that boy with the drum (Woo)If I pull it out, then that boy gonna run (Brrt, brrt)If he want the smoke, knock the beef out his bun, ayyI go dumb, dumb, dumb (Go dumb)Air it out, leave him slump-slump-slumped (Baow)Fuck what they say, they know that I'm gucciPull up with a pump-pump-pump (Pop, pop, pop)"
244,spotify:track:1D066zixBwqFYqBhKgdPzp,Fergalicious,Fergie,True,0.967,0.583,7.0,-5.562,0.0789,0.0584,0.0,0.0519,0.964,117.0,80,"[Intro: will.i.am, Derrick Rahming](Four, tres, two, uno)Listen up y'all, 'cause this is itThe beat that I'm banging is delicious[Verse 1: Fergie]Fergalicious definition, make the boys go locoThey want my treasures so they get their pleasures from my photoYou can see me, you can't squeeze meI ain't easy, I ain't sleazyI got reasons why I tease 'emBoys just come and go like seasons[Pre-Chorus: Fergie, will.i.am, Derrick Rahming]Fergalicious (So delicious)But, I ain't promiscuousAnd if you were suspiciousAll that shit is fictitiousI blow kisses (Muah!)That puts them boys on rock, rockAnd they be lining down the blockJust to watch what I got (Four, tres, two, uno)[Chorus: Fergie]It's so delicious(It's hot, hot)It's so delicious(I put them boys on rock, rock)It's so delicious(They want a taste of what I got)I'm Fergalicious(T-t-t-t-t-tasty, tasty)"
249,spotify:track:2xLOMHjkOK8nzxJ4r6yOKR,Birthday,Katy Perry,False,0.647,0.514,8.0,-10.05,0.0593,0.0655,0.0,0.398,0.386,79.975,87,"[Verse 1]I heard you're feelin' nothin's going rightWhy don't you let me stop by?The clock is tickin', runnin' out of timeSo we should party all night[Pre-Chorus]So cover your eyes, I have a surpriseI hope you got a healthy appetiteIf you wanna dance, if you want it allYou know that I'm the girl that you should call (Come on)[Chorus]Boy, when you're with me, I'll give you a tasteMake it like your birthday every dayI know you like it sweet, so you can have your cakeGive you something good to celebrate[Post-Chorus]So make (So make) a wish (A wish)I'll make it like your birthday every dayI'll be (I'll be) your gift (Your gift)Give you something good to celebrate[Verse 2]Pop your confetti, pop your PérignonSo hot and heavy 'til dawnI got you spinnin' like a disco ballAll night they're playin' your song"
254,spotify:track:4rHZZAmHpZrA3iH5zx8frV,Mirrors,Justin Timberlake,False,0.58,0.908,4.0,-5.303,0.0341,0.000335,4.84e-05,0.087,0.427,115.016,70,"[Verse 1]Aren't you somethin' to admire?'Cause your shine is somethin' like a mirrorAnd I can't help but noticeYou reflect in this heart of mineIf you ever feel alone andThe glare makes me hard to findJust know that I'm alwaysParallel on the other side[Pre-Chorus]'Cause with your hand in my hand and a pocket full of soulI can tell you there's no place we couldn't goJust put your hand on the glassI'll be there to pull you throughYou just gotta be strong[Chorus]'Cause I don't wanna lose you nowI'm lookin' right at the other half of meThe vacancy that sat in my heartIs a space that now you holdShow me how to fight for nowAnd I'll tell you, baby, it was easyComin' back here to you once I figured it outYou were right here all alongIt's like you're my mirror (Oh)My mirror staring back at me  (Oh)I couldn't get any bigger (Oh)With anyone else beside me (Oh)And now it's clear as this promiseThat we're makingTwo reflections into one'Cause it's like you're my mirror (Oh)My mirror staring back at me, staring back at me"
256,spotify:track:6etwirSInfuJrSOlogS6Sh,American Boy,Estelle,True,0.772,0.705,0.0,-6.255,0.0411,0.247,0.0,0.23,0.834,124.908,68,"[Intro: Kanye West & Estelle]This a number one champion sound (Yeah)Yeah, Estelle, we 'bout to get down (Get down)Who the hottest in the world right now? (Uh)Just touched down in London town (Uh)Bet they give me a pound (Uh)Tell 'em put the money in my hand right now (Yes)Tell the promoter we need more seatsWe just sold out all the floor seats[Chorus 1: Estelle]Take me on a trip, I'd like to go some dayTake me to New York, I'd love to see LAI really want to come kick it with youYou'll be my American boy[Verse 1: Estelle]He said, ""Hey, sister, it's really, really nice to meet ya""I just met this 5-foot-7 guy who's just my typeLike the way he's speakin', his confidence is peakin'Don't like his baggy jeans but I might like what's underneath themAnd, no, I ain't been to MIAI heard that Cali never rains and New York's wide awakeFirst let's see the West End, I'll show you to my bredrinI'm likin' this American boy, American boy"
257,spotify:track:46q5BtHso0ECuTKeq70ZhW,How Bizarre,OMC,False,0.724,0.73,7.0,-8.628,0.11,0.0561,0.0749,0.347,0.559,135.015,44,"[Verse 1]Brother Pele's in the back, sweet Sina's in the frontCruising down the freeway in the hot, hot sunSuddenly red-blue lights flash us from behindLoud voice booming, ""Please step out onto the line""Pele preaches words of comfort, Sina just hides her eyesPoliceman taps his shades, ""Is that a Chevy '69?""[Chorus]How bizarreHow bizarre, how bizarre[Verse 2]Destination unknown as we pull in for some gasA freshly pasted poster reveals a smile from the pastElephants and acrobats, lions, snakes, monkeyPele speaks ""righteous,"" Sister Sina says, ""funky""[Chorus]How bizarreHow bizarre, how bizarreOoh, baby (Ooh, baby)It's making me crazy (It's making me crazy)Every time I look around (Look around)Every time I look around (Every time I look around)Every time I look aroundIt's in my face"
259,spotify:track:4y3BUo2hp0MxylfbUaqRyJ,Stuck In The Middle,Tai Verdes,True,0.914,0.732,8.0,-6.1,0.241,0.0166,0.0,0.107,0.469,94.066,70,"[Intro]You know what she said to me?[Verse 1]She said, ""You're a player, aren't you?And I bet you got hoes""I said, ""You don't know me like thatI just go with the flow, oh, oh""She said, ""You can't fool me like thatYou're gonna leave me on read""I said, ""Why don't you try me on out?I know you wanna be friends""[Pre-Chorus]But friends turn into sleepoversAnd sleepovers turn into loveLove turns into jealousyAnd now we both fucked up[Chorus]'Cause we're stuck in the middle of lovers and friendsAnd we're losing every part of the benefitsYou hurt me more than I ever knewBut it's shitty 'cause I'm doing the same to you[Verse 2]She said, ""Are we exclusive or not?"" (Exclusive or not)I said, ""What do you wanna do?Seems like you love me a lot"" (Seems like you love me a lot)She said, ""Can we stop the jokingAnd take me seriously?"" (Take me seriously)I said, ""I'll try my very bestBut we'll have to wait and see"" (Let's wait and see)"
260,spotify:track:0A1hoCfMLkiAgvhWkkucJa,Body,Megan Thee Stallion,True,0.98,0.413,8.0,-11.052,0.101,0.671,7.95e-05,0.17,0.764,119.993,71,"[Intro]Real hot girl shitAhAnd if the beat live, you know Lil Ju made it[Chorus]Body-ody-ody-ody-ody-ody-ody-odyOdy-ody-ody-ody-ody-ody-ody (Mwah)Body-ody-ody-ody-ody-ody-ody-odyOdy-ody-ody-ody-ody-ody-odyBody crazy, curvy, wavy, big titties, lil' waist (Yeah, yeah, yeah)Body crazy, curvy, wavy, big titties, lil' waist (Mwah)Body-ody-ody-ody-ody-ody-ody-odyOdy-ody-ody-ody-ody-ody-ody[Verse 1]Look at how I bodied that, ate it up and gave it back (Ugh)Yeah, you look good, but they still wanna know where Megan at (Where Megan at?)Saucy like a barbecue but you won't get your baby backSee me in that dress and he feel like he almost tasted that (Ah, ah, ah)Num, num, num, num, eat it up, foreplay, okay, three, two, oneYou know I'm the hottest, you ain't ever gotta heat me upI'm present whеn I'm absent, speakin' when I'm not thеreAll them bitches scary cats, I call 'em Carole Baskins, ah[Chorus]Body-ody-ody-ody-ody-ody-ody-odyOdy-ody-ody-ody-ody-ody-ody (Ah)Body-ody-ody-ody-ody-ody-ody-odyOdy-ody-ody-ody-ody-ody-ody (Baow)Body crazy, curvy, wavy, big titties, lil' waist (Yeah, yeah)Body crazy, curvy, wavy, big titties, lil' waist (Yeah, yeah)Body-ody-ody-ody-ody-ody-ody-odyOdy-ody-ody-ody-ody-ody-ody"
261,spotify:track:6Pgmqg15yVexuOgtzuxwoX,Dancing in My Room,347aidan,True,0.583,0.829,1.0,-4.603,0.134,0.00864,0.0,0.0426,0.575,174.028,85,"[Intro]Ah, yeah, na-na, na-na, yeahNa, na-na, na-na-na-na, na-na (Ahh)Damn, Aidan, what you up to, bro?What you been up to, Aidan? Yo, yeah, I been[Chorus]Dancing in my room, swaying my feetTryna give you love and a kiss on the cheekCotton candy skies like I'm stuck in a dreamAnd I've been feeling blue, you're the one that I needDancing in my room, swaying my feetTryna give you love and a kiss on the cheekCotton candy skies like I'm stuck in a dreamAnd I've been feeling blue, you're the one that I need (Yeah)[Verse 1]And baby, yeah, you give me reasonsJust to fight all of my demonsYeah, I love it when you're speaking'Cause you silence all my feelingsThat feeling that I'm not okayAnd everyone will run awayAnd lеave me in my room (Room)Alone for just anothеr dayI'm sippin' on some lemonadeI wonder if you'll ever changeFuck it, I don't even careBaby, just go and ride my wave"
262,spotify:track:49FYlytm3dAAraYgpoJZux,Umbrella,Rihanna,False,0.849,0.536,1.0,-7.307,0.349,0.0239,0.0,0.126,0.308,141.964,64,"[Intro: JAY-Z]Uh-huh, uh-huh (Yeah, Rihanna)Uh-huh, uh-huh (Good Girl Gone Bad)Uh-huh, uh-huh (Take three, action)Uh-huh, uh-huh (Hov)[Verse 1: JAY-Z & Rihanna]No clouds in my stonesLet it rain, I hydroplane in the bankComin' down with the Dow Jones (Ayy, ayy, ayy)When the clouds come, we go, we Roc-A-Fella (Ayy-ayy-ayy, ayy)We fly higher than weather, in G5's or betterYou know me (You know me)In anticipation for precipitation, stack chips for the rainy dayJay, Rain Man is back (Ayy-ayy-ayy, ayy)With Little Miss Sunshine, Rihanna, where you at?  (Ayy-ayy-ayy, ayy)[Verse 2: Rihanna]You have my heart, and we'll never be worlds apartMay be in magazines but you'll still be my starBaby, 'cause in the dark, you can't see shiny carsAnd that's when you need me thereWith you, I'll always share because[Chorus: Rihanna]When the sun shine, we shine togetherTold you I'll be here foreverSaid ""I'll always be your friend""Took an oath, I'ma stick it out 'til the endNow that it's rainin' more than everKnow that we'll still have each otherYou can stand under my umbrellaYou can stand under my umbrellaElla-ella, ayy, ayy, ayyUnder my umbrellaElla-ella, ayy, ayy, ayyUnder my umbrellaElla-ella, ayy, ayy, ayyUnder my umbrellaElla-ella, ayy, ayy, ayy, ayy, ayy, ayy"
263,spotify:track:4Z5FyQlevoHoa5FsIVKZju,PRACTICE,DaBaby,True,0.88,0.504,2.0,-6.76,0.0609,0.0532,0.0715,0.443,0.476,120.043,64,"[Intro]OkayBoom, boom, boom (Firzt on the track)Boom, boom, boom[Chorus]I be feelin' like I don't be poppin' enough, I be humbleI'ma keep showin' my ass if I wannaHang up the phone on they ass, block the numberI told you don't play with me, niggaAnd she be actin' funny, probably think a nigga need her (Uh-uh)I thought I was faithful, she say I'm a cheaterThey thought I was taken, I'm ready to mingleThe fuck is you saying, lil' nigga? (Go)[Verse 1]I do my lil' dancy-dance (Go)I fill up my pants with bands, quit playing, lil' niggaAnd I don't think the talk is cheap (Talk)'Cause now when they talk to me, they paying me, nigga (Shut up)I probably say the word ""nigga"" too muchI'm a real nigga, I don't be giving a fuck (Shh)Tommy Hilfiger 'fits with the shit coming up (Go)When you stay down like this, you rock Fendi and stuff (Okay)He broke as hell, put a boot on himI hit the bitch, put her out, put a move on her (Bitch)He wanna be just like Baby for realOn the low tryna do what I do, don't he? (Yeah)Just so you prepared, I'ma let you knowThey probably told you I'm scared, but I'm ready, though (No)The industry can't take the hood out of me'Bout to go get some head from a ghetto ho (Uh-uh)They do it nastyPull up new whip and it's flashyGun on my hip and it's plasticThis the deluxeI like her, but don't give a fuck (Fuck)I'm fucking her rough, I'm her daddy (Mmm)That's how I liveShe told me she wanna have kids (Mmm)I told her don't know what that is (Uh-uh)That ain't how we speakin' (Uh-huh)I broke her heart into piecesShe probably gon' call Dr. Phil"
264,spotify:track:0vLUcf0D21qANv4C2ES7Ay,Upside Down,JVKE,False,0.716,0.512,1.0,-6.257,0.0331,0.483,0.0,0.0928,0.326,104.957,78,"[Pre-Chorus: JVKE, KBFR]Down south, hood baby (Hood baby)Make all the girls go crazy (Ah)Go (Go)Go (Go)Go stupidBut you smart like an A-plus student[Chorus: JVKE]Up, down, right, downLooking for your love right nowLa-la-la-laUp, down, all aroundTurn my stomach upside downLa-la-la-la[Verse: JVKE]I found your hair-tie in my carI could only drive so far without a breakdown (Ah)Baby, you’re the queen of heartsYou know how to play your cards, you keep ‘em face-down (Ah)Ooh, I miss your face nowLookin’ at your pictures, scrollin’ way down (Ah)Wishing I could fix all my mistakesI wish I could erase youGirl, I can’t replaceYou’re the one that got away (Ooh)"
265,spotify:track:7uoFMmxln0GPXQ0AcCBXRq,Snowman,Sia,False,0.828,0.492,0.0,-9.744,0.0276,0.0644,0.00428,0.128,0.789,120.151,88,"[Verse 1]Don't cry, snowman, not in front of meWho'll catch your tears if you can't catch me, darling?If you can't catch me, darlingDon't cry, snowman, don't leave me this wayA puddle of water can't hold me close, babyCan't hold me close, baby[Chorus]I want you to know that I'm never leaving'Cause I'm Mrs. Snow, 'til death we'll be freezingYeah, you are my home, my home for all seasonsSo come on, let's goLet's go below zero and hide from the sunI'll love you forever where we'll have some funYes, let's hit the North Pole and live happilyPlease don't cry no tears now, it's Christmas, baby[Post-Chorus]My snowman and me, ehMy snowman and meBaby[Verse 2]Don't cry, snowman, don't you fear the sunWho'll carry me without legs to run, honey?Without legs to run, honeyDon't cry, snowman, don't you shed a tearWho'll hear my secrets if you don't have ears, baby?If you don't have ears, baby"
270,spotify:track:0QkWikH5Z3U0f79T9iuF6c,Judas,Lady Gaga,False,0.551,0.756,2.0,-4.948,0.0652,0.0511,0.0,0.0765,0.618,175.984,69,"[Chorus]Whoa-whoa-whoa-whoa-whoaI'm in love with Juda-as, Juda-asWhoa-whoa-whoa-whoa-whoaI'm in love with Juda-as, Juda-as[Post-Chorus]Judas, Juda-ah-ahJudas, Juda-ah-ahJudas, Juda-ah-ahJudas, Gaga-ahJudas, Juda-ah-ahJudas, Juda-ah-ahJudas, Juda-ah-ahJudas, Gaga-ah[Verse 1]When he calls to me, I am readyI'll wash his feet with my hair if he needsForgive him when his tongue lies through his brainEven after three times he betrays me[Pre-Chorus](Ah-ah, ah-ah-ah-ah, ah-ah, ah-ah-ah-ah)I'll bring him downBring him down, down(Ah-ah, ah-ah-ah-ah, ah-ah, ah-ah-ah-ah)A king with no crownKing with no crown"
271,spotify:track:6qCsKKS7Ol63SJW3LOIX5R,Plastic Hearts,Miley Cyrus,False,0.707,0.924,7.0,-2.842,0.031,0.000972,0.00703,0.204,0.919,127.937,83,"[Intro]Ah![Verse 1]HelloThe sunny place for shady peopleA crowded room where nobody goesYou can be whoever you wanna be hereAnd oh, I've been livin' at the ChateauShouldn't drive, but I should really go homeI don't even know 'em, but they won't leave here[Pre-Chorus]Frightened by my own reflectionDesperate for a new connectionPull you in, but don't you get too closeLove you now, but not tomorrowWrong to steal, but not to borrowPull you in, but don't you get too close[Chorus]I've been California dreamin'Plastic hearts are bleedin'Keep me up all night (Keep me up)Keep me up all night (All night)Lost in black hole conversationSunrise suffocationKeep me up all night (Keep me up)Keep me up all night"
273,spotify:track:35mvY5S1H3J2QZyna3TFe0,positions,Ariana Grande,True,0.845,0.662,4.0,-9.18,0.245,0.00738,0.0,0.344,0.94,98.0,54,"[Verse 1]Heaven sent you to meI'm just hopin’ I don't repeat history[Pre-Chorus]Boy, I'm tryna meet your mama on a SundayThen make a lotta love on a Monday (Ah, ah)Never need no (No), no one else, babe’Cause I'll be[Chorus]Switchin' them positions for youCookin' in the kitchen and I'm in the bedroomI'm in the Olympics, way I'm jumpin' through hoopsKnow my love infinite, nothin’ I wouldn’t doThat I won't do, switchin’ for you[Verse 2]Perfect, perfectYou're too good to be true (You're too good to be true)But I get tired of runnin', fuck itNow, I’m runnin' with you (With you)[Pre-Chorus]Said, boy, I'm tryna meet your mama on a SundayThen make a lotta love on a Monday (Ah, ah)Never need no (No), no onе else, babe'Causе I'll be"
275,spotify:track:0RE4crnT3jRms1xxVlEZx2,Bad boy,Marwa Loud,False,0.741,0.565,5.0,-5.448,0.108,0.114,0.0,0.205,0.892,134.122,78,"[Intro]On n’a pas, pas d’bolT’as que des bad girls ouais t’es qu’un bad boy[Couplet 1]Le but d’une vie c’est d’faire d’la monnaieC’est pas ton équipe ils t’ont racoléToutes tes copines ouais on les connaîtÀ force de zoner ouais on les a rodéesJ’suis abattue je perds le filEt t’as pas un euro, fais pas de dealEt t’as pas un kilo fais pas le dealerJ’prends pas ça au sérieuxOuais ça fait des leurres, eh, ehLa go se dandine, eh, eh, elle veut tous vos num’, eh, ehPourtant c’est qu’une gamineMais comme elle s’ennuie ce monde la fascine[Pré-refrain]Moi j’voulais m’en aller (m'en aller)Et ce, depuis, ouais, tant d’années (tant d’années)J’essaye de faire le videDe souvent sourire, de faire le tri (bad bad bad boy)Moi j’voulais m’en allerEt ce depuis ouais tant d’années (bad bad bad boy)J’essaye de faire le videDe souvent sourire, ouais de faire le tri (bad bad bad boy)"
276,spotify:track:3JsydWaf2Ev4ehaLUjj3SY,Confident,Justin Bieber,False,0.457,0.823,9.0,-4.76,0.311,0.00144,0.0,0.108,0.578,192.205,70,"[Intro: Justin Bieber]Don't do it to meDon't do it to me (Oh, no, no, oh, no, no)Don't do it to me (Oh, no, no, oh, no, no)Don't do it to me (Oh, no, no, oh, no, no)Don't do it to me (Oh, no, no, oh, no, no)[Verse 1: Justin Bieber]Focused, I'm focusedShe got a body like that, I ain't never seen nothin' like that, uh-uhLike a fantasy in front of me, yeahI think that somethin' special is goin' downThat's right, I think she foreign (Foreign)I think she foreign (Foreign), got passportsMi amor ('Mor) started slow (Slow), got fasterShe gon' work some more (More), work some more (More)No stoppin' her now (Now, now)No stoppin' her now (Now, now, now, now)[Pre-Chorus: Justin Bieber]Then she started dancing, sexual romancin'Nasty but she fancy, lipstick on my satin sheetsWhat's your nationality? I wonder if there's more of youShe's got my attention, she's confident[Chorus: Justin Bieber]Oh, no, no, oh, no, no, she's confidentOh, no, no, oh, no, no, and I'm down with itOh, no, no, oh, no, no, she's confidentYou could tell by the way she walks in the room"
279,spotify:track:2ZRo7axmMPeSVUvDbGkJah,Hope,XXXTENTACION,True,0.663,0.477,1.0,-8.839,0.0414,0.644,0.0,0.122,0.643,143.173,77,"[Intro]YeahRest in peace to all the kids that lost their lives in the Parkland shooting, this song is dedicated to you[Chorus]Okay, she keep cryin', she keep cryin' every single nightDay and night, on my mind, please don't kill the vibeOh no, I swear to God, I be in my mindSwear I wanna die, yeah, when you cross my—Said I wanna die, yuh, no, I'm not alright, yuhI might start a riot, yuh, I'm so fuckin' tired, yuhSo what's up? What you say? Feelin' good, I'm feelin' greatTired of the fuckin' hate, stackin' cheese all on my plate[Bridge]So outside my misery, I think I'll findA way of envisioning a better lifeFor the rest of us, the rest of usThere's hope for the rest of us, the rest of us[Chorus]Okay, she keep cryin', she keep cryin' every single nightDay and night, on my mind, please don't kill the vibeOh no, I swear to God, I be in my mindSwear I wanna die, yeah, when you cross my—Said I wanna die, yuh, no, I'm not alright, yuhI might start a riot, yuh, I'm so fuckin' tired, yuhSo what's up? What you say? Feelin' good, I'm feelin' greatTired of the fuckin' hate, stackin' cheese all on my plate"
